company,valuation,datejoined,country,city,industry,selectinvestors
imply data,1,5/17/2022,united states,burlingame,data management & analytics,"andreessen horowitz, bessemer venture partners, khosla ventures,"
material security,1,5/11/2022,united states,redwood city,cybersecurity,"andreessen horowitz, founders fund"
physicswallah,1,6/7/2022,india,uttar pradesh,edtech,"gsv ventures, westbridge capital"
recover,1,6/9/2022,spain,banyeres de mariola,other,"goldman sachs asset management, story3 capital partners"
purplle,1,6/9/2022,india,mumbai,e-commerce & direct-to-consumer,"blume ventures, jsw ventures, ivycap ventures"
cais,1,1/11/2022 ,united states,new york,fintech,"franklin templeton, motive partners. apollo global management"
nxin,1,9/18/2018,china,beijing,internet software & services,"beijing juneng hesheng industry investment fund, beijing shuju xinrong fund"
uisee technology,1,1/25/2021,china,beijing,"supply chain, logistics, & delivery","shenzhen capital group, robert bosch venture capital, septwolves ventures"
56pingtai,1,1/25/2021,china,shanghai,"supply chain, logistics, & delivery","qf capital, qc capital, unicom innovation venture capital"
cirkul,1,6/13/2022,united states,sarasota,consumer & retail,"af ventures, siddhi capital, sc.holdings"
radius payment solutions,1,11/27/2017,united kingdom,crewe,fintech,inflexion private equity
rivigo,1,7/11/2019,india,gurgaon,"supply chain, logistics, & delivery","saif partners india, warburg pincus, trifecta capital advisors"
mamaearth,1,12/28/2021,india,gurgaon,e-commerce & direct-to-consumer,"fireside ventures, sequoia capital india, stellaris venture partners"
0x,1,4/26/2022,united states,san francisco,fintech,"jump capital, pantera capital, greylock partners"
jiuxian,1,7/30/2015,china,beijing,e-commerce & direct-to-consumer,"sequoia capital china, rich land capital, merrysunny wealth"
instabase,1,10/21/2019,united states,san francisco,data management & analytics,"new enterprise associates, greylock partners, andreessen horowitz"
sendbird,1,4/6/2021,united states,san mateo,mobile & telecommunications,"fundersclub, y combinator, tiger global management"
density,1,11/10/2021,united states,san francisco,hardware,"founders fund, upfront ventures,  01 advisors"
mixpanel,1,11/15/2021,united states,san francisco,internet software & services,"bain capital tech opportunities, andreessen horowitz, sequoia capital"
branch,1,3/1/2022,united states,columbus,fintech,"american family ventures, greycroft, signalfire"
aprogen,1,5/31/2019,south korea,seongnam-si,health,"lindeman asia investment, nichi-iko pharmaceutical"
orcam technologies,1,2/20/2018,israel,jerusalem,artificial intelligence,"intel capital, aviv venture capital"
ample,1,11/11/2021,united states,san francisco,hardware,"shell ventures, blackstone, moore strategic ventures"
leap motor,1,11/20/2018,china,hangzhou,auto & transportation,"sequoia capital china, gopher asset management, shanghai electric group"
wheel,1,1/19/2022,united states,austin,health,"silverton partners, tusk ventures, crv"
flow,1,8/15/2022,united states,new york,fintech,andreessen horowitz
xanadu,1,11/9/2022,canada,toronto,hardware,"bdc capital, georgian, bessemer venture partners"
line man wongnai,1,9/26/2022,thailand,bangkok,e-commerce & direct-to-consumer,"brv capital management, bualuang ventures"
celestia,1,10/19/2022,liechtenstein,vaduz,internet software & services,"placeholder capital, coinbase ventures, binance ventures"
stability ai,1,10/5/2022,united kingdom,london,artificial intelligence,"lightspeed venture partners, coatue management"
vesttoo,1,10/25/2022,israel,tel aviv-yafo,fintech,"mouro capital, hanaco venture capital, gramercy ventures"
satispay,1,9/28/2022,italy,milan,fintech,"lightrock, greyhound capital, endeavor"
paystand,1,8/2/2022,united states,scotts valley,fintech,"bluerun ventures, leap global partners, cervin ventures"
turntide technologies,1,6/15/2022,united states,sunnyvale,auto & transportation,"meson capital partners, fifth wall ventures, ogci climate investments"
ecovadis,1,6/14/2022,france,paris,"supply chain, logistics, & delivery","astorg partners, princeville global, beyond net zero"
transfermate,1,5/22/2022,ireland,kilkenny,fintech,railway pension trustee co. ltd.
lookout,1,10/10/2013,united states,san francisco,cybersecurity,"accel partners, greylock partners, lowercase capital"
perimeter 81,1,6/6/2022,israel,tel aviv,cybersecurity,"insight partners, toba capital, spring ventures"
snapdeal,1,5/21/2014,india,new delhi,e-commerce & direct-to-consumer,"softbankgroup, blackrock, alibaba group"
techstyle fashion group,1,8/29/2014,united states,el segundo,e-commerce & direct-to-consumer,"matrix partners, passport capital, rho ventures"
zebec,1,8/29/2022,united states,san francisco,fintech,"resolute ventures, shima capital, circle ventures"
inmobi,1,12/2/2014,india,bengaluru,mobile & telecommunications,"kleiner perkins caufield & byers, softbank corp., sherpalo ventures"
linksure network,1,1/1/2015,china,shanghai,mobile & telecommunications,n/a
red ventures,1,1/7/2015,united states,fort mill,other,"silver lake partners, general atlantic"
beibei,1,1/22/2015,china,hangzhou,e-commerce & direct-to-consumer,"banyan capital, new horizon capital, idg capital partners"
lamabang,1,3/6/2015,china,shenzhen,e-commerce & direct-to-consumer,"5y capital, matrix partners china, k2vc"
jimubox,1,4/21/2015,china,beijing,fintech,"matrix partners china, ventech china, shunwei capital partners"
fxiaoke,1,7/2/2015,china,beijing,mobile & telecommunications,"idg capital, northern light venture capital, dcm ventures"
vox media,1,8/12/2015,united states,washington,internet software & services,"accel partners, comcast ventures, general atlantic"
miacom,1,9/8/2015,china,beijing,e-commerce & direct-to-consumer,"sequoia capital china, zhenfund, k2 ventures"
58 daojia,1,10/12/2015,china,beijing,internet software & services,"kkr, alibaba group, ping an insurance"
womai,1,10/12/2015,china,beijing,e-commerce & direct-to-consumer,"saif partners china, baidu, idg capital"
hujiang,1,10/29/2015,china,shanghai,edtech,"china minsheng investment, baidu, wanxin media"
itutorgroup,1,11/18/2015,china,shanghai,edtech,"qiming venture partners, temasek holdings, silverlink capital"
mindmaze,1,1/28/2016,switzerland,lausanne,health,hinduja group
icarbonx,1,4/12/2016,china,shenzhen,artificial intelligence,"tencent, vcanbio"
sassist,1,6/7/2016,united states,chicago,internet software & services,"goldman sachs, insights venture partners, pritzker group venture capital"
kenscott,1,12/21/2016,united states,austin,consumer & retail,"berkshire partners, norwest venture partners"
mobvoi,1,4/6/2017,china,beijing,consumer & retail,"sequoia capital china, sig asia investments, zhenfund"
zhuan zhuan,1,4/18/2017,china,beijing,e-commerce & direct-to-consumer,"58.com, tencent holdings"
modernizing medicine,1,5/10/2017,united states,boca raton,health,"warburg pincus, summit partners, sands capital"
zhaogang,1,6/29/2017,china,shanghai,e-commerce & direct-to-consumer,"k2 ventures, matrix partners china, idg capital"
dianrong,1,8/2/2017,china,shanghai,e-commerce & direct-to-consumer,"standard chartered, finsight ventures, affirma capital"
cell c,1,8/7/2017,south africa,midrand,mobile & telecommunications,"blue label telecoms, net1 ueps technologies"
yh global,1,9/21/2017,china,shenzhen,"supply chain, logistics, & delivery","co-energy finance, grandland"
revolution precrafted,1,10/23/2017,philippines,manila,other,"k2 global, 500 startups"
welab,1,11/8/2017,hong kong,,fintech,"sequoia capital china, ing, alibaba entrepreneurs fund"
maimai,1,11/15/2017,china,beijing,mobile & telecommunications,"morningside venture capital, idg capital, dcm ventures"
dxycn,1,4/10/2018,china,hangzhou,health,"tencent holdings, dcm ventures"
hmd global,1,5/21/2018,finland,espoo,mobile & telecommunications,ginko ventures
huike group,1,5/24/2018,china,beijing,edtech,"fosun rz capital, oceanwide holdings, shenzhen qianhe capital management co."
china cloud,1,6/11/2018,china,wuxi,hardware,"v star capital, gf xinde investment management co., haitong leading capital management"
linkdoc technology,1,7/5/2018,china,beijing,health,"china investment corporation, new enterprise associates"
mediamath,1,7/10/2018,united states,new york,internet software & services,"silicon valley bank, qed investors, european founders fund"
movile,1,7/12/2018,brazil,sao paulo,mobile & telecommunications,"innova capital - fip, 3g capital management, prosus ventures"
pat mcgrath labs,1,7/16/2018,united states,new york,consumer & retail,"one luxury group, eurazeo"
wacai,1,7/18/2018,china,hangzhou,mobile & telecommunications,"qiming venture partners, china broadband capital, cdh investments"
flashex,1,8/27/2018,china,beijing,"supply chain, logistics, & delivery","prometheus capital, matrix partners china, jd capital management"
banma network technologies,1,9/13/2018,china,shanghai,auto & transportation,"yunfeng capital, sdic innovation investment management, shang qi capital"
tresata,1,10/10/2018,united states,charlotte,fintech,gcp capital partners
momenta,1,10/17/2018,china,beijing,artificial intelligence,"sinovation ventures, tencent holdings, sequoia capital china"
hosjoy,1,10/18/2018,china,nanjing,e-commerce & direct-to-consumer,"u.s.-china green fund, founder h fund, richland equities"
omio,1,10/23/2018,germany,berlin,travel,"lakestar, battery ventures, new enterprise associates"
terminus technology,1,10/25/2018,china,beijing,hardware,"china everbright limited, idg capital, iflytek"
bitfury,1,11/6/2018,netherlands,amsterdam,hardware,"georgian co-investment fund, itech capital, galaxy digital"
reef technology,1,12/10/2018,united states,miami,"supply chain, logistics, & delivery","target global, ubs asset management, mubadala capital"
globality,1,1/22/2019,united states,menlo park,artificial intelligence,softbank group
ynsect,1,2/21/2019,france,evry,other,"astanor ventures, upfront ventures, idinvest partners"
intellifusion,1,3/22/2019,china,shenzhen,artificial intelligence,"boc international, toposcend capital, hongxiu vc"
poizon,1,4/29/2019,china,shanghai,mobile & telecommunications,"dst global, sequoia capital china, gaorong capital"
vts,1,5/7/2019,united states,new york,internet software & services,"trinity ventures, fifth wall ventures, openview venture partners"
sitech dev,1,5/16/2019,china,guiyang,other,china prosperity capital
knowbox,1,5/30/2019,china,beijing,edtech,"tal education group, legend star, alibaba group"
yanolja,1,6/10/2019,south korea,seoul,travel,"sbi investment korea, partners investment, gic"
meero,1,6/18/2019,france,paris,artificial intelligence,"aglae ventures, global founders capital, alven capital"
ibotta,1,8/6/2019,united states,denver,fintech,"koch disruptive technologies, teamworthy ventures, ggv capital"
c2fo,1,8/7/2019,united states,leawood,fintech,"union square ventures, summerhill venture partners, mithril capital management"
numbrs,1,8/22/2019,switzerland,zurich,fintech,"investment corporation of dubai, centralway"
ebanx,1,10/16/2019,brazil,curitiba,fintech,"ftv capital, endeavor"
kk group,3,10/23/2019,china,dongguan,e-commerce & direct-to-consumer,"matrix partners china, bright venture capita, shenzhen capital group"
alto pharmacy,1,1/30/2020,united states,san francisco,health,"jackson square ventures, greenoaks capital management, softbank group"
hotmart,1,3/17/2020,netherlands,amsterdam,e-commerce & direct-to-consumer,"technology crossover ventures, alkeon capital management, general atlantic"
emerging markets property group,1,4/28/2020,united arab emirates,dubai,other,"olx group, kck group, exor seeds"
quizlet,1,5/13/2020,united states,san francisco,edtech,"union square ventures, altos ventures, costanoa ventures"
orca bio,1,6/17/2020,united states,menlo park,health,"lightspeed venture partners, data collective, 8vc"
infobip,1,7/30/2020,croatia,vodnjan,mobile & telecommunications,one equity partners
zwift,1,9/16/2020,united states,long beach,e-commerce & direct-to-consumer,"novator partners, true, causeway media partners"
playco,1,9/21/2020,japan,tokyo,other,"sozo ventures, caffeinated capital, sequoia capital"
gousto,1,11/3/2020,united kingdom,london,"supply chain, logistics, & delivery","mmc ventures, bgf ventures, unilever ventures"
alation,1,6/3/2021,united states,redwood city,internet software & services,"costanoa ventures, data collective, salesforce ventures"
boom supersonic,1,12/16/2020,united states,englewood,other,"wrvi capital, caffeinated capital, y combinator"
quantum metric,1,1/7/2021,united states,colorado springs,data management & analytics,"insight partners, bain capital ventures"
news break,1,1/7/2021,united states,mountain view,internet software & services,"idg capital, francisco partners, zhenfund"
madeiramadeira,1,1/7/2021,brazil,parana,e-commerce & direct-to-consumer,"flybridge capital partners, softbank group, monashees+"
ppro,1,1/19/2021,united kingdom,london,fintech,"wellington management, eurazeo, citi ventures"
splashtop,1,1/27/2021,united states,san jose,internet software & services,"storm ventures, dfj dragonfund, new enterprise associates"
flash express,1,2/1/2021,thailand,bangkok,"supply chain, logistics, & delivery","scb 10x, krungsri finnovate, ewtp capital"
axiom space,1,2/16/2021,united states,houston,other,"c5 capital, hemisphere ventures, the venture collective"
locus robotics,1,2/17/2021,united states,wilmington,hardware,"scale venture partners, bond, tiger global management"
standard,1,2/17/2021,united states,san francisco,artificial intelligence,"crv, y combinator, initialized capital"
webull,1,2/18/2021,china,changsha,fintech,"bojiang capital, hongdao capital, mobai capital"
skydio,1,2/25/2021,united states,redwood city,"supply chain, logistics, & delivery","andreessen horowitz, andreessen horowitz, institutional venture partners, accel"
newsela,1,2/25/2021,united states,new york,edtech,"owl ventures, technology crossover ventures, tao capital partners"
aqua security,1,3/10/2021,israel,ramat gan,cybersecurity,"tlv partners, lightspeed venture partners, m12"
patsnap,1,3/16/2021,singapore,,internet software & services,"sequoia capital china, shunwei capital partners, qualgro"
evidation,1,3/22/2021,united states,san mateo,health,"b capital group,, ge ventures, mckesson ventures"
sidecar health,1,1/26/2021,united states,el segundo,fintech,"greatpoint ventures, tiger global management, menlo ventures"
feedzai,1,3/24/2021,united states,san mateo,artificial intelligence,"global founders capital, shea ventures, greycroft"
yunxuetang,1,3/29/2021,china,suzhou,edtech,"matrix partners china, sequoia capital china, hundreds capital"
cameo,1,3/30/2021,united states,chicago,internet software & services,"lightspeed venture partners, kleiner perkins caufield & byers, origin ventures"
hyperchain,1,4/11/2021,china,hangzhou,fintech,"yinhong equity investment fund, e fund, ideal international"
the zebra,1,4/12/2021,united states,austin,e-commerce & direct-to-consumer,"silverton partners, accel, ballast point ventures"
clearcover,1,4/13/2021,united states,chicago,fintech,"american family ventures, cox enterprises, omers ventures"
groq,1,4/14/2021,united states,mountain view,artificial intelligence,"tdk ventures, social capital, d1 capital partners"
fiture,1,4/14/2021,china,chengdu,health,"bertelsmann asia investments, sequoia capital china, nio capital"
injective protocol,1,4/20/2021,united states,new york,fintech,"pantera capital, cadenza ventures, blocktower capital"
sift,1,4/22/2021,united states,san francisco,artificial intelligence,"union square ventures, insight partners, spark capital"
saltpay,1,4/9/2021,united kingdom,london,fintech,"tiger global management, hedosophia"
capsule,1,4/28/2021,united states,new york,health,"thrive capital, durable capital partners, g squared"
moloco,1,4/29/2021,united states,redwood city,artificial intelligence,"smilegate investment, dsc investments, ktb ventures"
inari,1,5/12/2021,united states,cambridge,other,"flagship pioneering, alexandria venture investments, investment corporation of dubai"
mux,1,4/30/2021,united states,san francisco,internet software & services,"accel, cobalt capital, andreessen horowitz"
xforceplus,1,6/1/2021,china,shanghai,internet software & services,"eastern bell capital, danhua capital, msa capital"
firefly aerospace,1,5/4/2021,united states,cedar park,other,"xbto ventures, raven one ventures, sk ventures"
augustinus bader,1,11/9/2022,london,united kingdom,consumer & retail,general atlantic
shift technology,1,5/6/2021,france,paris,artificial intelligence,"griffin gaming partners, andreessen horowitz, battery ventures"
tenstorrent,1,5/5/2021,canada,toronto,artificial intelligence,"eclipse ventures, fidelity investments, moore capital management"
zihaiguo,1,5/6/2021,china,chongqing,consumer & retail,"xingwang investment management, china capital investment group, matrix partners china"
forte labs,1,5/12/2021,united states,san francisco,fintech,"iris capital, accel, elaia partners"
axtria,1,5/13/2021,united states,berkeley heights,data management & analytics,"helion venture partners, bain capital tech opportunities, sequoia capital india"
amount,1,5/17/2021,united states,chicago,fintech,"invus group, hanaco venture capital, westcap group"
vise,1,5/18/2021,united states,new york,fintech,"sequoia capital, founders fund, bling capital"
printful,1,5/24/2021,united states,charlotte,other,bregal sagemount
matrixport,1,6/1/2021,singapore,,fintech,"dragonfly captial, qiming venture partners, dst global"
shippo,1,6/2/2021,united states,san francisco,"supply chain, logistics, & delivery","version one ventures, uncork capital, bessemer venture partners"
thirty madison,1,6/2/2021,united states,new york,health,"northzone ventures, maveron, johnson & johnson innovation"
letsgetchecked,1,6/7/2021,ireland,dublin,health,"optum ventures, qiming venture partners, transformation capital"
ecoflow,1,6/10/2021,china,shenzhen,hardware,"delian capital, china international capital corporation, sequoia capital china"
carro,1,6/14/2021,singapore,,e-commerce & direct-to-consumer,"singtel innov8, alpha jwc ventures, golden gate ventures"
tractable,1,6/16/2021,united kingdom,london,artificial intelligence,"insight partners, ignition partners, georgian partners"
xiaoe tech,1,6/15/2021,china,shenzhen,internet software & services,"ggv capital, hillhouse capital management, idg capital"
bringg,1,6/16/2021,israel,tel aviv,"supply chain, logistics, & delivery","salesforce ventures, next47, pereg ventures"
claroty,1,6/17/2021,united states,new york,cybersecurity,"bessemer venture partners, morevc, team8"
joytunes,1,6/21/2021,israel,tel aviv,edtech,"genesis partners, aleph, insight partners"
aircall,1,6/23/2021,united states,new york,internet software & services,"balderton capital, next world capital, draper esprit"
worldcoin,1,6/29/2021,united states,san francisco,fintech,"day one ventures, coinbase ventures, andreessen horowitz"
smartasset,1,6/24/2021,united states,new york,fintech,"javelin venture partners, ttv capital, peterson ventures"
morning consult,1,6/8/2021,united states,washington dc,internet software & services,"advance venture partners, susquehanna growth equity, lupa systems"
visier,1,6/29/2021,canada,vancouver,internet software & services,"foundation capital,  summit partners, adams street partners"
shipbob,1,6/29/2021,united states,chicago,"supply chain, logistics, & delivery","hyde park venture partners, fundersclub. bain capital ventures"
mobilecoin,1,7/7/2021,united states,san francisco,fintech,"general catalyst, future ventures, au21"
amperity,1,7/13/2021,united states,seattle,artificial intelligence,"madrona venture group, tiger global management, madera technology partners"
pantheon systems,1,7/13/2021,united states,san francisco,internet software & services,"foundry group, scale venture partners, softbank group"
xiaobing,1,7/12/2021,china,beijing,fintech,"netease capital, northern light venture capital, microsoft"
dmed biopharmaceutical,1,7/12/2021,china,shanghai,health,"qiming venture partners, vivo capital, sequoia capital china"
carson group,1,7/14/2021,united states,lincoln,fintech,bain capital
go1,1,7/19/2021,australia,brisbane,internet software & services,"y combinator, m12, seek"
interos,1,7/22/2021,united states,arlington,"supply chain, logistics, & delivery","kleiner perkins caufield & byers, nightdragon security, venrock"
blackbuck,1,7/22/2021,india,bengaluru,"supply chain, logistics, & delivery","accel, sands capital, international finance corporation"
nium,1,7/13/2021,singapore,,fintech,"vertex ventures se asia, global founders capital, visa ventures"
human interest,1,8/4/2021,united states,san francisco,fintech,"wing venture capital, slow ventures, uncork capital"
bluecore,1,8/5/2021,united states,new york,artificial intelligence,"firstmark capital, georgian partners, norwest venture partners"
freshbooks,1,8/10/2021,canada,toronto,fintech,"accomplice, oak investment partners, georgian partners"
snorkel ai,1,8/9/2021,united states,palo alto,artificial intelligence,"greylock partners, google ventures, blackrock"
gelato,1,8/16/2021,norway,oslo,e-commerce & direct-to-consumer,"greylock partners, google ventures, blackrock"
maven clinic,1,8/17/2021,united states,new york,health,"female founders fund, oak hc/ft partners, sequoia capital"
dunamu,1,7/22/2021,south korea,seoul,fintech,"qualcomm ventures, woori investment, hanwha investment & securities"
shield ai,1,8/24/2021,united states,san diego,artificial intelligence,"andreessen horowitz, homebrew, point72 ventures"
picsart,1,8/26/2021,united states,san francisco,mobile & telecommunications,"sequoia capital, dcm ventures, insight partners"
1kmxc,1,8/30/2021,china,hangzhou,hardware,"goldman sachs asset management, sdp investment, alibaba group"
cider,1,9/2/2021,hong kong,,e-commerce & direct-to-consumer,"andreessen horowitz, dst global, idg capital"
berlin brands group,1,9/1/2021,germany,berlin,e-commerce & direct-to-consumer,"ardian, bain capital"
agile robots,1,9/9/2021,germany,munich,hardware,"hillhouse capital management, sequoia capital china, linear venture"
grubmarket,1,9/14/2021,united states,san francisco,e-commerce & direct-to-consumer,"ggv capital, blackrock, ace & company"
mammoth biosciences,1,9/9/2021,united states,brisbane,health,"nfx, plum alley, mayfield"
orchard,1,9/9/2021,united states,new york,fintech,"accomplice, juxtapose, firstmark capital"
xendit,1,9/14/2021,indonesia,jakarta,fintech,"accel, y combinator, amasia"
truelayer,1,9/21/2021,united kingdom,london,fintech,"anthemis, connect ventures, northzone ventures"
assembly,1,9/21/2021,united states,culver city,internet software & services,"advent international, psg, providence equity partners"
pandadoc,1,9/22/2021,united states,san francisco,internet software & services,"rembrandt venture partners, m12, altos ventures"
keenon robotics,1,9/15/2021,china,shanghai,"supply chain, logistics, & delivery","yunqi partners, softbank group, ivision ventures"
haydon,1,9/24/2021,china,shanghai,consumer & retail,"tencent holdings, hillhouse capital management"
ninja van,1,9/27/2021,singapore,,"supply chain, logistics, & delivery","b capital group, monk's hill ventures, dynamic parcel distribution"
vedantu,1,9/29/2021,india,bengaluru,edtech,"accel, tiger global management, omidyar network"
trialspark,1,9/30/2021,united states,new york,health,"sequoia capital, thrive capital, sound ventures"
ajaib,1,10/4/2021,indonesia,jakarta,fintech,"softbank ventures asia, alpha jwc ventures, insignia ventures partners"
licious,1,10/5/2021,india,bengaluru,e-commerce & direct-to-consumer,"3one4 capital partners, bertelsmann india investments, vertex ventures se asia"
masterworks,1,10/5/2021,united states,new york,fintech,"left lane capital, galaxy interactive, tru arrow partners"
chronosphere,1,10/7/2021,united states,new york,data management & analytics,"greylock partners, lux capital, general atlantic"
soloio,1,10/7/2021,united states,cambridge,internet software & services,"true ventures, altimeter capital, redpoint ventures"
savage x fenty,1,2/10/2021,united states,el segundo,e-commerce & direct-to-consumer,"speedinvest, valar ventures, uniqa ventures"
swile,1,10/11/2021,france,montpellier,fintech,"index ventures, idinvest partners, daphni"
mobikwik,1,10/13/2021,india,gurugram,fintech,"sequoia capital india, the times group, gmo venturepartners"
weights & biases,1,10/13/2021,united states,san francisco,artificial intelligence,"coatue management, insight partners, trinity ventures"
zopa,1,10/19/2021,united kingdom,london,fintech,"iag capital partners, augmentum fintech, northzone ventures"
dental monitoring,1,10/21/2021,france,paris,health,"vitruvian partners, merieux equity partners, straumann"
cargox,1,10/21/2021,brazil,sao paulo,"supply chain, logistics, & delivery","valor capital group, lightrock, softbank group"
fabric,1,10/26/2021,united states,new york,"supply chain, logistics, & delivery","innovation endeavors, aleph, temasek"
augury,1,10/26/2021,united states,new york,artificial intelligence,"lerer hippeau, munich re ventures, eclipse ventures"
moka,1,11/2/2021,china,beijing,internet software & services,"ggv capital, gsr ventures, freesfund"
tezign,1,11/2/2021,china,shanghai,internet software & services,"sequoia capital china, linear venture, hearst ventures"
vagaro,1,11/3/2021,united states,dublin,internet software & services,ftv capital
drata,1,11/8/2021,united states,san diego,cybersecurity,"cowboy ventures, leaders fund, ggv capital"
razor,1,11/8/2021,germany,berlin,consumer & retail,"global founders capital, 468 capital, redalpine venture partners"
igaworks,1,11/8/2021,south korea,seoul,internet software & services,"korea investment private equity, atinum investment, korea investment partners"
contrast security,1,11/9/2021,united states,los altos,cybersecurity,"acero capital, general catalyst, m12"
