company,valuation,datejoined,country,city,industry,selectinvestors
vast data,3,4/16/2020,united states,new york,data management & analytics,"norwest venture partners, goldman sachs, dell technologies capital"
goat,3,9/23/2020,united states,culver city,e-commerce & direct-to-consumer,"upfront ventures, webb investment network, d1 capital partners"
noom,3,5/24/2021,united states,new york,health,"qualcomm ventures, samsung ventures, silver lake"
redwood materials,3,7/28/2021,united states,carson city,other,"breakthrough energy ventures, capricorn investment group, valor equity partners"
papaya global,3,3/4/2021,united states,new york,internet software & services,"bessemer venture partners, insight partners, new era ventures"
abogen,3,11/29/2021,china,suzhou,health,"hillhouse capital management, softbank group, qiming venture partners"
harness,3,1/14/2021,united states,san francisco,artificial intelligence,"menlo ventures, alkeon capital management, citi ventures"
whatnot,3,9/16/2021,united states,marina del rey,e-commerce & direct-to-consumer,"y combinator, andreessen horowitz, wonder ventures"
autograph,3,1/20/2022,united states,santa monica,internet software & services,01 advisors. kleiner perkins caufield & byers. andreessen horowitz
relativity,3,3/18/2021,united states,chicago,internet software & services,"silver lake, iconiq capital"
whoop,3,10/28/2020,united states,boston,e-commerce & direct-to-consumer,"nextview ventures, promus ventures, two sigma ventures"
applied intuition,3,10/22/2020,united states,sunnyvale,auto & transportation,"andreessen horowitz, lux capital, general catalyst"
course hero,3,2/12/2020,united states,redwood city,edtech,"newview capital, maveron, ridge ventures"
spoton,3,5/26/2021,united states,san francisco,fintech,"dragoneer investment group, dst global, franklin templeton"
otto bock healthcare,3,6/24/2017,germany,duderstadt,health,eqt partners
indigo ag,3,9/26/2017,united states,boston,artificial intelligence,"activant capital group, alaska permanent fund, baillie gifford & co."
hyalroute,3,5/26/2020,singapore,,mobile & telecommunications,kuang-chi
rec room,3,3/23/2021,united states,seattle,internet software & services,"first round capital, sequoia capital, index ventures"
commure,3,9/16/2021,united states,san francisco,internet software & services,"general catalyst, hca healthcare"
mirakl,3,9/22/2020,france,paris,e-commerce & direct-to-consumer,"elaia partners, 83north, felix capital"
tekion,3,10/21/2020,united states,san ramon,internet software & services,"airbus ventures, index ventures, advent international"
celsius network,3,10/12/2021,united states,hoboken,fintech,"westcap group, caisse de depot et placement du quebec"
gostudent,3,6/22/2021,austria,vienna,edtech,"dn capital, left lane capital, coatue management"
highspot,3,2/22/2021,united states,seattle,internet software & services,"madrona venture group, shasta ventures, salesforce ventures"
handshake,3,5/12/2021,united states,san francisco,internet software & services,"kleiner perkins caufield & byers, lightspeed venture partners, true ventures"
chargebee technologies,3,4/20/2021,united states,san francisco,fintech,"insight partners, tiger global management, accel"
flock safety,3,7/13/2021,united states,atlanta,hardware,"matrix partners, initialized capital, tiger global management"
helion energy,3,11/5/2021,united states,redmond,other,"mithril capital management, y combinator, capricorn investment group"
acronis,3,9/18/2019,switzerland,schaffhausen,cybersecurity,"goldman sachs, vebventures, insight partners"
unacademy,3,9/2/2020,india,bengaluru,edtech,"blume ventures, nexus venture partners, sequoia capital india"
moonpay,3,11/22/2021,united states,miami,fintech,"new enterprise associates, coatue management, tiger global management"
upstox,3,11/29/2021,india,mumbai,fintech,"tiger global management, kalaari capital"
improbable,3,5/11/2017,united kingdom,london,other,"andreessen horowitz, softbank group, temasek holdings"
youxia motors,3,4/2/2018,china,shanghai,auto & transportation,"china environmental protection industry, china fortune ocean"
ownbackup,3,1/28/2021,united states,englewood cliffs,data management & analytics,"insight partners, salesforce ventures, vertex ventures"
starburst,3,1/6/2021,united states,boston,data management & analytics,"index ventures, coatue management, andreessen horowitz"
starling bank,3,3/8/2021,united kingdom,london,fintech,"jtc group, qatar investment authority, fidelity investment"
ecarx,3,10/26/2020,china,wuhan,auto & transportation,"geely, sig asia investments, china state capital venture capital fund"
sila nanotechnologies,3,4/16/2019,united states,alameda,other,"bessemer venture partners, sutter hill ventures, matrix partners"
scopely,3,10/29/2019,united states,culver city,mobile & telecommunications,"greycroft, sands capital, revolution growth"
komodo health,3,5/22/2020,united states,san francisco,health,"andreessen horowitz, ia ventures, felicis ventures"
kurly,3,7/9/2021,south korea,seoul,"supply chain, logistics, & delivery","sequoia capital china, dst global, dst global"
cars24,3,11/24/2020,india,gurgaon,e-commerce & direct-to-consumer,"moore strategic ventures, dst global, sequoia capital india"
blockdaemon,3,9/21/2021,united states,los angeles,fintech,"boldstart ventures, lerer hippeau, kenetic capital"
dadi cinema,3,5/11/2016,china,shenzhen,other,alibaba pictures group
aiven,3,10/18/2021,finland,helsinki,internet software & services,"institutional venture partners, atomico, earlybird venture capital"
astera labs,3,11/17/2022,united states,santa clara,hardware,"intel capital, sutter hill ventures, venturetech"
thumbtack,3,9/29/2015,united states,san francisco,e-commerce & direct-to-consumer,"tiger global, sequoia capital, google capital"
cedar,3,3/9/2021,united states,new york,fintech,"thrive capital, founders fund, cocnord health partners"
eruditus executive education,3,8/12/2021,india,mumbai,edtech,"sequoia capital india, softbank, bertelsmann india investments"
blockstream,3,8/24/2021,canada,vancouver,fintech,"ame cloud ventures, future perfect ventures, blockchain capital"
innovaccer,3,2/19/2021,united states,san francisco,health,"m12, westbridge capital, lightspeed venture partners"
ironclad,3,1/18/2022,united states,sacramento,internet software & services,"accel, sequoia capital, y combinator"
skims,3,4/9/2021,united states,los angeles,e-commerce & direct-to-consumer,"thrive capital, alliance consumer growth, imaginary ventures"
eikon therapeutics,3,1/6/2022,united states,hayward,health,"the column group, foresite capital, foresite capital"
retool,3,12/22/2021,united states,san francisco,internet software & services,sequoia capital
verkada,3,1/29/2020,united states,san mateo,cybersecurity,"next47, first round capital, sequoia capital"
psiquantum,3,7/27/2021,united states,palo alto,hardware,"playground global, m12, blackrock"
udaan,3,9/4/2018,india,bengaluru,"supply chain, logistics, & delivery","dst global, lightspeed venture partners, microsoft scaleup"
highradius,3,1/7/2020,united states,houston,fintech,"susquehanna growth equity, citi ventures, iconiq capital"
nuvemshop,3,8/17/2021,brazil,sao paulo,e-commerce & direct-to-consumer,"kaszek ventures, qualcomm ventures, accel"
yixia,3,11/24/2015,china,beijing,mobile & telecommunications,"sequoia capital china, sina weibo, kleiner perkins caufield & byers, redpoint ventures"
traveloka,3,1/1/2017,indonesia,jakarta,travel,"global founders capital, east ventures, expedia inc."
souche holdings,3,11/1/2017,china,hangzhou,e-commerce & direct-to-consumer,"morningside ventures, warburg pincus, creditease fintech investment fund"
bgl group,3,11/24/2017,united kingdom,peterborough,fintech,cpp investment board
circle,3,5/15/2018,united states,boston,fintech,"general catalyst, digital currency group, accel"
zuoyebang,3,7/18/2018,china,beijing,edtech,"sequoia capital china, xiang he capital, ggv capital"
flixmobility,3,7/18/2019,germany,munich,auto & transportation,"holtzbrinck ventures, unternehmertum venture capital, general atlantic"
wildlife studios,3,12/5/2019,brazil,sao paulo,other,"benchmark, bessemer venture partners"
applyboard,3,5/5/2020,canada,kitchener,edtech,"artiman ventures, plug and play ventures, anthos capital"
forter,3,11/19/2020,united states,new york,cybersecurity,"sequoia capital israel, scale venture partners, commerce ventures"
calendly,3,1/26/2021,united states,atlanta,internet software & services,"iconiq capital, openview venture partners"
blockfi,3,3/11/2021,united states,jersey city,fintech,"consensys ventures, valar ventures, puc"
activecampaign,3,4/21/2021,united states,chicago,internet software & services,"silversmith capital partners, susquehanna growth equity, tiger global management"
csurgical,3,9/17/2019,united kingdom,cambridge,health,"cambridge innovation capital, lgt capital partners, escala capital"
lucid software,3,6/29/2021,united states,south jordan,internet software & services,"spectrum equity, iconiq capital, grayhawk capital"
age of learning,3,5/3/2016,united states,glendale,edtech,iconiq capital
carbon health,3,7/21/2021,united states,san francisco,health,"brookfield asset management, blackstone, data collective"
contentful,3,7/28/2021,germany,berlin,internet software & services,"balderton capital, general catalyst, tiger global management"
launchdarkly,3,8/10/2021,united states,oakland,internet software & services,"uncork capital, threshold ventures, bloomberg beta"
seismic,3,12/18/2018,united states,san diego,internet software & services,"jackson square ventures, general atlantic, lightspeed venture partners"
grafana labs,3,3/25/2021,united states,new york,internet software & services,"lightspeed venture partners, lead edge capital, coatue management"
gorillas,3,3/25/2021,germany,berlin,"supply chain, logistics, & delivery","coatue management, atlantic food labs, dst global"
sky mavis,3,10/4/2021,vietnam,ho chi minh city,internet software & services,"fabric ventures, 500 global, standard crypto"
outschool,3,4/14/2021,united states,san francisco,edtech,"uniion square ventures, tiger global management, lightspeed venture capital"
tradingview,3,10/14/2021,united states,westerville,fintech,"tiger global management, insight partners, jump capital"
groww,3,4/7/2021,india,bengaluru,fintech,"tiger global management, sequoia capital india, ribbit capital"
podium,3,4/7/2020,united states,lehi,internet software & services,"accel, summit partners, google ventures"
via,3,3/30/2020,united states,new york,auto & transportation,"83north, riverpark ventures, pitango venture capital"
anchorage digital,3,12/15/2021,united states,san francisco,fintech,"andreessen horowitz, blockchain capital, lux capital"
inxeption,3,1/13/2022,united states,san francisco,fintech,"coatue management, bmo capital, schonfeld strategic advisors"
lattice,3,3/23/2021,united states,san francisco,internet software & services,"khosla ventures, thrive capital, y combinator"
flutterwave,3,3/9/2021,united states,san francisco,fintech,"green visor capital, cre venture capital, greycroft"
amber group,3,6/21/2021,hong kong,,fintech,"tiger global management, tiger brokers, dcm ventures"
cross river bank,3,2/11/2022,united states,fort lee,fintech,"battery ventures, andreessen horowitz, ribbit capital"
remote,3,7/13/2021,united states,san francisco,fintech,"index ventures, sequoia capital, general catalyst"
sentry,3,2/18/2021,united states,san francisco,other,"new enterprise associates, accel, bond"
kraken,2,6/25/2019,united states,san francisco,fintech,"bnk to the future, trammell ventures, sbi investment"
openai,2,7/22/2019,united states,san francisco,artificial intelligence,khosla ventures
workrise,2,9/30/2019,united states,austin,internet software & services,"founders fund, quantum energy partners, bedrock capital"
loft,2,1/3/2020,brazil,sao paulo,e-commerce & direct-to-consumer,"monashees+, andreessen horowitz, qed investors"
drivewealth,2,8/20/2021,united states,chatham,fintech,"point72 ventures, route 66 ventures, accel"
flink,2,12/1/2021,germany,berlin,e-commerce & direct-to-consumer,"mubadala capital, bond, prosus ventures"
alan,2,4/19/2021,france,paris,fintech,"index ventures, temasek, portag3 ventures"
meicai,2,6/22/2016,china,beijing,mobile & telecommunications,"tiger global management, blue lake capital, zhenfund"
zipline,2,5/20/2019,united states,south san francisco,"supply chain, logistics, & delivery","sequoia capital, baillie gifford & co., google ventures"
graphcore,2,12/18/2018,united kingdom,bristol,artificial intelligence,"dell technologies capital, pitango venture capital, amadeus capital partners"
illumio,2,4/14/2015,united states,sunnyvale,cybersecurity,"data collective, formation 8, general catalyst partners"
masterclass,2,5/13/2021,united states,san francisco,edtech,"institutional venture partners, new enterprise associates, javelin venture partners"
dream games,2,6/30/2021,turkey,istanbul,mobile & telecommunications,"makers fund, index ventures, inova ventures participacees"
transmit security,2,6/22/2021,israel,tel aviv,cybersecurity,"general atlantic, insight partners, vintage investment partners"
hozon auto,3,2/22/2022,china,shanghai,auto & transportation,"hd capital, qihoo 360 technology, china fortune land development"
tradeshift,2,5/30/2018,united states,san francisco,fintech,"notion capital, scentan ventures, kite ventures"
nextiva,2,9/14/2021,united states,scottsdale,internet software & services,goldman sachs asset management
tridge,2,8/24/2022,south korea,seoul,internet software & services,"forest partners, softbank ventures asia"
o9 solutions,2,4/28/2020,united states,dallas,artificial intelligence,kkr
thought machine,2,11/29/2021,united kingdom,london,fintech,"british patient capital, seb venture capital, iq capital"
backbase,2,6/9/2022,netherlands,amsterdam,fintech,motive partners
manomano,2,7/5/2021,france,paris,e-commerce & direct-to-consumer,"general atlantic, piton capital, partech partners"
sourcegraph,2,7/13/2021,united states,san francisco,internet software & services,"redpoint ventures, goldcrest capital, insight partners"
pendo,2,10/17/2019,united states,raleigh,internet software & services,"contour venture partners, battery ventures, core capital partners"
plume,2,2/23/2021,united states,palo alto,internet software & services,"insight partners, jackson square ventures, liberty gloval ventures"
moglix,2,5/17/2021,singapore,,e-commerce & direct-to-consumer,"jungle ventures, accel, venture highway"
axonius,2,3/1/2021,united states,new york,cybersecurity,"vertex ventures israel, bessemer venture partners, emerge"
xinchao media,2,4/9/2018,china,chengdu,internet software & services,"jd.com, baidu, vision plus capital"
jumpcloud,2,9/13/2021,united states,louisville,data management & analytics,"foundry group, general atlantic, blackrock"
unico,2,8/3/2021,brazil,sao paulo,artificial intelligence,"big bets, general atlantic, softbank latin america ventures"
oura,2,4/5/2022,finland,oulu,health,"forerunner ventures, lifeline ventures, msd capital"
eat just,2,11/30/2017,united states,san francisco,consumer & retail,"khosla ventures, horizons ventures, founders fund"
cribl,2,8/25/2021,united states,san francisco,data management & analytics,"institutional venture partners, crv, sequoia capital"
jetti resources,2,10/24/2022,united states,boulder,other,"bmw i ventures, bhp ventures"
vista global,2,8/23/2017,united arab emirates,dubai,other,rhone capital
byton,2,4/20/2018,china,nanjing,auto & transportation,"faw group, tencent holdings, tus holdings"
side,2,3/22/2021,united states,san francisco,internet software & services,"coatue managemeny, trinity ventures, matrix partners"
inframarket,2,2/25/2021,india,thane,e-commerce & direct-to-consumer,"accel, tiger global management, nexus venture partners"
varo bank,2,9/9/2021,united states,san francisco,fintech,"warburg pincus, the rise fund, harbourvest partners"
cato networks,2,11/17/2020,israel,tel aviv,cybersecurity,"aspect ventures, singtel innov8, greylock partners"
aura,2,6/9/2021,united states,burlington,cybersecurity,"warburg pincus, general catalyst"
vercel,2,6/23/2021,united states,san francisco,internet software & services,"crv, accel, google ventures"
sysdig,2,4/28/2021,united states,san francisco,cybersecurity,"accel, bain capital ventures, insight partners"
zetwerk,2,8/20/2021,india,bengaluru,internet software & services,"sequoia capital india, kae capital, accel"
uniphore,2,2/16/2022,united states,palo alto,artificial intelligence,"chiratae ventures, march capital partners, national grid partners"
somatus,2,2/23/2022,united states,mclean,health,"the blue venture fund, flare capital partners, longitude capital"
immutable,2,3/7/2022,australia,sydney,fintech,"fabric ventures, airtree ventures, temasek"
a24 films,2,3/9/2022,united states,new york,other,"stripes group, neuberger berman"
sifive,2,3/16/2022,united states,san mateo,hardware,"sutter hill ventures, osage university partners, spark capital"
games24x7,2,3/30/2022,india,mumbai,internet software & services,"tiger global management, the raine group, malabar investments"
fetch rewards,2,3/31/2021,united states,madison,e-commerce & direct-to-consumer,"greycroft, loeb.nyc, dst global"
coda payments,2,4/15/2022,singapore,,fintech,"gic. apis partners, insight partners"
drivenets,2,1/27/2021,israel,ra'anana,internet software & services,"bessemer venture partners, pitango venture capital, d1 capital partners"
hibob,2,10/12/2021,israel,tel aviv,internet software & services,"bessemer venture partners, eight roads ventures, battery ventures"
uala,2,8/13/2021,argentina,buenos aires,fintech,"soros fund management, ribbit capital, monashees+"
mobile premier league,2,9/15/2021,india,bengaluru,internet software & services,"sequoia capital india, rtp global, go-ventures"
cybereason,2,8/6/2019,united states,boston,cybersecurity,"softbank group, crv, spark capital"
cgtz,2,2/21/2017,china,hangzhou,fintech,"shunwei capital partners, china media group, guangzhou huiyin aofeng equity investment fund"
star charge,2,5/19/2021,china,changzhou,auto & transportation,"shunwei capital partners, china media group, guangzhou huiyin aofeng equity investment fund"
equipmentshare,2,5/1/2020,united states,columbia,fintech,"romulus capital, insight partners, redbird capital partners"
carbon,2,8/20/2015,united states,redwood city,hardware,"google ventures, sequoia capital, wakefield group"
rokt,2,12/16/2021,united states,new york,internet software & services,"square peg capital, tdm growth partners, tiger global management"
policybazaar,2,5/6/2019,india,gurgaon,fintech,"info edge, softbank capital"
paxos,2,4/29/2021,united states,new york,fintech,"liberty city ventures, rre ventures, mithril capital management"
exabeam,2,6/1/2021,united states,foster city,cybersecurity,"norwest venture partners, aspect ventures, lightspeed venture partners"
bitsight technologies,2,9/13/2021,united states,boston,cybersecurity,"menlo ventures, ggv capital, flybridge capital partners"
trumid,2,7/15/2020,united states,new york,fintech,"t. rowe price, dragoneer investment group, blackrock"
abl space systems,2,3/25/2021,united states,el segundo,other,"t. rowe price, lockheed martin ventures, fidelity investment"
honeybook,2,5/4/2021,united states,san francisco,internet software & services,"norwest venture partners, hillsven capital, aleph"
beta technologies,2,4/19/2022,united states,south burlington,other,"the rise fund, fidelity investments. redbird capital partners"
project44,2,6/1/2021,united states,chicago,"supply chain, logistics, & delivery","emergence capital partners, 8vc, chicago ventures"
freenome,2,8/26/2020,united states,south san francisco,health,"andreessen horowitz, data collective, roche venture fund"
manypets,2,6/1/2021,united kingdom,london,fintech,"octopus ventures, munich re ventures, commerzventures"
jobandtalent,2,12/1/2021,spain,madrid,internet software & services,"kibo ventures, softbank group, atomico"
wemakeprice,2,9/9/2015,south korea,seoul,e-commerce & direct-to-consumer,"imm investment, nxc"
biren technology,2,8/18/2020,china,shanghai,hardware,"v fund, idg capital, green pine capital partners"
voodoo,2,8/17/2020,france,paris,other,"tencent holdings, goldman sachs"
uptake,2,10/27/2015,united states,chicago,artificial intelligence,"revolution, new enterprise associates, caterpillar"
motive,2,4/23/2019,united states,san francisco,"supply chain, logistics, & delivery","google ventures, index ventures, scale venture partners"
greenlight,2,9/24/2020,united states,atlanta,fintech,"relay ventures, ttv capital, canapi ventures"
bowery farming,2,5/25/2021,united states,new york,other,"temasek, google ventures, general catalyst"
odoo,2,7/29/2021,belgium,louvain-la-neuve,internet software & services,"summit partners, noshaq, sofinnova partners"
momo,2,12/10/2021,vietnam,ho chi minh city,fintech,"goodwater capital, warburg pincus, gs growth"
zume,2,11/1/2018,united states,mountain view,consumer & retail,"softbank group, ame cloud ventures, signalfire"
algolia,2,7/28/2021,united states,san francisco,internet software & services,"accel, alven capital, storm ventures"
pattern,2,10/6/2021,united states,lehi,internet software & services,"knox lane, ainge advisory, carlson private capital partners"
newfront insurance,2,4/12/2022,united states,san francisco,fintech,"founders fund, meritech capital partners, gs growth"
nucom group,2,2/22/2018,germany,unterfoehring,other,general atlantic
musinsa,2,11/11/2019,south korea,seoul,e-commerce & direct-to-consumer,sequoia capital
current,2,4/27/2021,united states,new york,fintech,"expa, qed investors, foundation capital"
bitso,2,5/5/2021,mexico,mexico city,fintech,"pantera capital, qed investors, coinbase ventures"
gympass,2,6/12/2019,united states,new york,internet software & services,"general atlantic, softbank group, atomico"
dialpad,2,10/6/2020,united states,san francisco,internet software & services,"andreessen horowitz, google ventures, section 32"
g7 networks,2,2/15/2022,china,beijing,"supply chain, logistics, & delivery","eastern bell capital 32, sdic cmc investment management, trustbridge partners"
bloomreach,2,2/23/2022,united states,mountain view,artificial intelligence,"bain capital ventures, sixth street growth, lightspeed venture partners"
motif foodworks,2,6/16/2021,united states,boston,consumer & retail ,"general atlantic, breakthrough energy ventures, viking global investors"
huaqin telecom technology,2,10/8/2019,china,shanghai,mobile & telecommunications,"zhangjiang haocheng venture capital, walden international, intel capital"
accelerant,2,1/12/2022,united kingdom,colchester,other,"deer park road, altamont capital partners, eldridge"
hesai tech,2,8/1/2020,china,shanghai,artificial intelligence,"lightspeed china partners, baidu ventures, qiming venture partners"
yitu technology,2,3/8/2018,china,shanghai,artificial intelligence,"sequoia capital china, banyan capital"
addepar,2,6/15/2021,united states,mountain view,fintech,"8vc, d1 capital partners, sway ventures"
qualia,2,12/21/2020,united states,san francisco,fintech,"8vc, menlo ventures, tiger global management"
neo4j,2,6/17/2021,united states,san mateo,data management & analytics,"eight roads ventures, one peak partners, creandum"
cloudwalk,2,9/8/2021,brazil,sao paulo,fintech,"plug and play ventures, valor capital group, dst global"
coindcx,2,8/10/2021,india,maharashtra,fintech,"polychain capital, coinbase ventures, jump capital"
firstcry,2,2/7/2020,india,pune,e-commerce & direct-to-consumer,"softbank group, saif partners india, valiant capital partners"
eightfoldai,2,10/27/2020,united states,santa clara,internet software & services,"foundation capital, institutional venture partners, general catalyst"
urban company,2,4/27/2021,india,gurgaon,e-commerce & direct-to-consumer,"vy capital, accel, elevation capital"
recharge,2,5/6/2021,united states,los angeles,fintech,"iconiq growth, bain capital ventures, summit partners"
moveworks,2,6/30/2021,united states,mountain view,artificial intelligence ,"lightspeed venture partners, sapphire ventures, kleiner perkins caufield & byers"
medable,2,10/26/2021,united states,palo alto,health,"gsr ventures, sapphire ventures, streamlined ventures"
gocardless,2,2/8/2022,united kingdom,london,fintech,"accel, passion capital, balderton capital"
forto,2,6/21/2021,germany,berlin,"supply chain, logistics, & delivery","cherry ventures, northzone ventures, global founders capital"
jeeves,2,3/14/2022,united states,orlando,fintech,"tencent holdings, crv, clocktower technology ventures"
babel finance,2,5/25/2022,hong kong,hong kong,fintech,"dragonfly capital, bai capital, 10t fund"
bezero,2,11/14/2022,united kingdom,london,other,"molten ventures, contrarian ventures, hitachi ventures"
trendy group international,2,2/13/2012,hong kong,kowloon,consumer & retail,l capital partners
mysten labs,2,9/8/2022,united states,san francisco,internet software & services,"andreessen horowitz, coinbase ventures, circle ventures"
avant,2,12/17/2012,united states,chicago,artificial intelligence,"rre ventures, tiger global, august capital"
tubatucom,2,3/9/2015,china,shenzhen,e-commerce & direct-to-consumer,"sequoia capital china, matrix partners china, 58.com"
blablacar,2,9/16/2015,france,paris,auto & transportation,"accel partners, index ventures, insight venture partners"
huimin,2,9/5/2016,china,beijing,e-commerce & direct-to-consumer,"zheshang venture capital, gp capital, western capital management"
quora,2,4/21/2017,united states,mountain view,internet software & services,"y combinator, matrix partners, benchmark"
preferred networks,2,5/17/2018,japan,tokyo,artificial intelligence,"toyota motor corporation, mizuho financial group, fanuc"
formlabs,2,8/1/2018,united states,somerville,hardware,"pitango venture capital, dfj growth fund, foundry group"
4paradigm,2,12/19/2018,china,beijing,artificial intelligence,"sequoia capital china, china construction bank, bank of china"
