name,headquarters,number_of_employees,address,industry,website,market_cap,telephone,revenue
us ecology inc,united states of america,"3,600","101 s capitol blvd ste 1000, boise, idaho, 83702",environmental and waste management services,www.usecology.com,,1 208 3318400,988
mercury systeinc,united states of america,"2,386","50 minuteman drive, andover, massachusetts, 01810",aerospace and defense,www.mrcy.com,2,1 978 2561300,988
xiwang foodstuffs co ltd,china,"1,892","xiwang industrial park, zouping county, binzhou, shandong , 256209",consumer packaged goods,www.xwsp.cc,787,86 543 4868888,985
shenzhen hepalink pharmaceutical group co ltd,china,"2,046","no. 19, hi-tech zhongyi avenue, middle area, hi-tech zone , nanshan dist, shenzhen, guangdong, 518057",pharmaceuticals and healthcare,www.hepalink.com,2,86 755 26980311,986
kingsoft corporation ltd,hong kong,"7,174","kingsoft tower, no. 33, xiaoying west road, haidian district, beijing, 100085",technology and communications,www.kingsoft.com,5,852  24050088,987
petropavlovsk plc,united kingdom,"8,860","11 grosvenor place, london, sw1x7hh",metals and mining,petropavlovskplc.com,,7 495 3802810,988
vat group ag,switzerland,"2,897","seelistrasse 1, haag, rheintal, 9469",industrial goods and machinery,www.vatvalve.com,9,41 81 7716161,986
software ag,germany,"5,052","uhlandstrasse 12, darmstadt, 64297",technology and communications,www.softwareag.com,2,49 6151 920,986
3sbio inc,china,"5,160","no. 3 a1, road 10, shenyang economy & technology, development zone, liaoning , 110027",pharmaceuticals and healthcare,www.3sbio.com,2,86 24 25811820,989
nomura co ltd,japan,"1,952","2-3-4, daiba, minato-ku, tokyo, 135-8622",construction,www.nomurakougei.co.jp,821,81 3 59621171,988
sapura energy bhd,malaysia,"3,440","no. 7, jalan tasik, mines resort city, seri kembangan, 43300",energy and utilities,www.sapuraenergy.com,184,60 3 86598800,990
deceuninck nv,belgium,"3,709","bruggesteenweg 360, gits, hooglede, 8830",construction,www.deceuninck.com,387,32 51 239211,991
finnair oyj,finland,"5,358","hott, tietotie 9, vantaa, 01530",transport and logistics,company.finnair.com,768,358 6 00081881,991
alok industries ltd,india,"26,231","peninsula business park, tower-b, 2nd & 3rd floor, g.k.marg, mumbai, 400013",consumer packaged goods,www.alokind.com,909,91 22 61787000,990
zhejiang weixing new building materials co ltd,china,"4,419","linhai economic development zone, taizhou, zhejiang, 317000",construction,www.vasen.com,5,86 576 85225086,990
redes energeticas nacionais sa,portugal,697,"avenida dos estados unidos da america, 55, lisboa, 1749-061",power,www.ren.pt,1,351 21 0013500,991
the shyft group inc,united states of america,"3,800","41280 bridge street, 1000 reynolds rd, novi, michigan, 48375",automotive,theshyftgroup.com,1,1 517 5436400,991
pjt partners inc,united states of america,833,"280 park ave fl 16th, new york, 10017-1206",financial services,pjtpartners.com,3,1 212 3647800,991
qatar gas transport co ltd,qatar,12,"al shoumoukh towers, c ring road, al-sadd, p.o. box 22271, doha",energy and utilities,www.nakilat.com,5,974  44998111,991
pt bank permata tbk,indonesia,"7,168","gedung world trade center ii, jl. jend. sudirman kav. 29-31, jakarta selatan, 12920",financial services,www.permatabank.com,2,62 21 5237788,992
fulgent genetics inc,united states of america,645,"4978 santa anita ave ste 205, temple city, california, 91780-3600",medical equipment,www.fulgentgenetics.com,975,1 626 3500537,992
globaltrans investment plc,cyprus,"1,750","office 201, 4 profiti ilia street, germasogeia, limassol, 4046",transport and logistics,www.globaltrans.com,799,357 25 212382,993
asia allied infrastructure holdings ltd,hong kong,"6,150","c2, 5th floor,hng kng spnrs indstrl bldg, 601-603 tai nan west street, cheung sha wan, kowloon, hong kong",construction,www.asiaalliedgroup.com,121,852  37985711,993
haemonetics corp,united states of america,"2,821","125 summer street, boston, massachusetts, 02110",medical equipment,www.haemonetics.com,4,1 781 8487100,993
boe varitronix limited,hong kong,"4,063","unit a-f, 35/f, legend tower, 7 shing yip street, kwun tong, hong kong",technology and communications,www.boevx.com,1,852  21976000,995
ebix inc,united states of america,"10,030","1 ebix way, johns creek, georgia, 30097",technology and communications,www.ebix.com,590,1 678 2812020,994
gsi creos corp,japan,624,"7-9f, aoba daiichi bldg., 2-3-1, kudan-minami, chiyoda-ku, tokyo, 102-0074",consumer packaged goods,www.gsi.co.jp,145,81 3 52111800,995
information services international-dentsu ltd,japan,"3,240","2-17-1, konan, minato-ku, tokyo, 108-0075",technology and communications,www.isid.co.jp,2,81 3 67136111,997
fulton financial corp,united states of america,"3,200","one penn square, lancaster, pennsylvania, 17602",financial services,www.fultonbank.com/about-fulton-bank,2,1 717 2912411,997
alpha networks inc,taiwan,"6,392","no.8, li-shing road vii, hsinchu science-based industrial park, 300",technology and communications,www.alphanetworks.com,533,886 3 5636666,998
ircon international ltd,india,"1,278","c-4, district centre, saket, new delhi, 110017",construction,www.ircon.org/index.php,709,91 11 29565666,999
rcs mediagroup spa,italy,"2,953","via angelo rizzoli, 8, milano, 20132",media,www.rcsmediagroup.it,392,39 02 25841,1
kiatnakin phatra bank public co ltd,thailand,"3,665","amarin tower, 500 ploenchit road, lumphini, pathumwan, bangkok, 10330",financial services,bank.kkpfg.com/th/home,1,66 21 655555,1
binggrae co ltd,south korea,"1,609","45, dasansunhwan-ro, namyangju, 12253",consumer packaged goods,www.bing.co.kr,315,82 2 20226000,1
winpak ltd,canada,"2,563","100 saulteaux cres, winnipeg, manitoba, r3j3t3",paper and packaging,www.winpak.com,2,1 204 8312244,1
land and houses public co ltd,thailand,"1,623","floor 37-38, q. house lumphini building, 1 south sathon road, thungmahamek, sathon, bangkok, 10120",construction,www.lh.co.th,3,66 23 438900,1
genting malaysia bhd,malaysia,"14,048","24th floor, wisma genting, jalan sultan ismail, kuala lumpur, 50250",leisure and arts,www.gentingmalaysia.com,3,60 3 21782288,1
nohmi bosai ltd,japan,"2,635","4-7-3, kudan minami, chiyoda-ku, tokyo, 102-8277",industrial goods and machinery,www.nohmi.co.jp,769,81 3 32650211,1
east african breweries plc,kenya,"1,576","gpo, p.o. box 30161, nairobi, 00100",consumer packaged goods,www.eabl.com,1,254 20 8644000,1
lier chemical co ltd,china,"5,360","building 5, no.58, huasheng road, chenghua district, chengdu, sichuan, 610052",chemicals,www.lierchem.com,2,86 28 67575627,1
seadrill ltd,bermuda,"3,220","14 par-la-ville road, park place, hamilton, hm11",energy and utilities,www.seadrill.com,,1 441 2421500,1
great eagle holdings ltd,hong kong,"5,200","33rd floor, great eagle centre, hong kong",construction,www.greateagle.com.hk,1,852  28273668,1
daewoong pharmaceutical co ltd,south korea,"1,256","35-14, jeyakgongdan 4-gil, hyangnam-eup, hwaseong, 18623",pharmaceuticals and healthcare,www.daewoong.com,1,8225508800,1
pt bumi resources tbk,indonesia,864,"jl. h.r. rasuna said, kompleks rasuna ep, lantai 12, bakrie tower, jakarta, 12960",metals and mining,www.bumiresources.com,3,62 21 57942080,1
astro malaysia holdings berhad,malaysia,"4,191","3f,admnstn bldg,all asia broadcast cntr, lebuhraya puchong-sungai besi, technology park malaysia, bukit jalil, kuala lumpur, 57000",media,corporate.astro.com.my,735,60 3 95436688,1
rizhao port co ltd,china,"5,709","haibin second road, rizhao, shandong , 276826",transport and logistics,www.rzpcl.com,1,86 633 8388822,1
birla corp ltd,india,"7,184","1, shakespeare sarani  2nd floor , kolkata, 700071",construction,www.birlacorporation.com,912,91 33 66033300,1
crest nicholson holdings plc,united kingdom,661,"crest house, pyrcroft road, chertsey, kt169gn",construction,www.crestnicholson.com,784,44 1932 580555,1
conmed corp,united states of america,"3,800","11311 concept boulevard, largo, florida, 33773",medical equipment,www.conmed.com,2,1 727 2142974,1
haverty furniture companies inc,united states of america,"2,845","suite 800, 780 johnson ferry road, atlanta, georgia, 30342",retailing,www.havertys.com,548,1 404 4432900,1
dachan food asia ltd,china,"8,071","room 401, 4th floor, office tower c, vanton center, no.6 chaowai street, chaoyang district, beijing, 100020",consumer packaged goods,www.dachanfoodasia.com/en/aboutus.php,74,,1
praktikertjanst ab,sweden,"6,700","adolf fredriks kyrkogata 9, stockholm, 10355",pharmaceuticals and healthcare,www.praktikertjanst.se,,46 10 1280000,1
china non-ferrous metal industrys foreign engineering and construction co ltd,china,"4,797","china nonferrous building, no. 10, anding road, chaoyang district, beijing, 100029",metals and mining,www.nfc.com.cn,1,86 10 84427227,1
bb seguridade participacoes sa,brazil,,"asa norte, brasilia, 70.040-912",financial services,www.bbseguridaderi.com.br/pt,13,55 61 34932929,1
texas capital bancshares inc,united states of america,"1,751","suite 700, 2000 mckinney ave, dallas, texas, 75201",financial services,www.texascapitalbank.com,3,1 214 9326600,1
shandong xinhua pharmaceutical co ltd,china,"6,540","no.1 lutai avenue, high-tech zone, zibo, shandong , 255086",pharmaceuticals and healthcare,www.xhzy.com,2,86 533 2166666,1
hbis resources co ltd,china,"4,004","no.385, tiyu south street, shijiazhuang, hebei, 050023",construction,www.hbiszy.com,1,86 311 66500923,1
nishat mills ltd,pakistan,"27,760","7, main gulberg, lahore, 54000",consumer packaged goods,www.nishatmillsltd.com,76,92 42 35716351,1
cadence bancorp,united states of america,"1,818","2800 post oak blvd ste 3800, houston, texas, 77056-6170",financial services,www.cadencebancorporation.com,,1 713 8714000,1
the a2 milk company ltd,new zealand,421,"po box 91976, auckland, 1142",consumer packaged goods,thea2milkcompany.com,3,64 9 3755998,1
soitec sa,france,"1,847","parc technologique des fontaines, chemin des franques, bernin, villard-bonnot, rhone alpes, 38190",technology and communications,www.soitec.com,5,33 4 76927500,1
pt timah tbk,indonesia,"4,564","jalan jenderal sudirman no.51, bangka belitung, pangkal pinang, 33121",metals and mining,www.timah.com,623,62 21 23528000,1
unitika ltd,japan,"3,037","osaka center bldg., 4-1-3, kyutaro-machi, chuo-ku, osaka-shi, 541-8566",chemicals,www.unitika.co.jp,107,81 6 62815695,1
owl rock capital corp,united states of america,,"399 park avenue, 38th floor, new york, 10022",financial services,www.owlrockcapitalcorporation.com,5,1 212 4193000,1
pt abm investama tbk,indonesia,"6,652","suite 1802, jl. cilandak kko no. 1, lantai 18, gedung tmt 1, jakarta selatan, 12560",metals and mining,www.abm-investama.com,573,62 21 29976767,1
bizlink holding inc,united states of america,"5,003","3400 gateway blvd, fremont, california, 94538-6583",technology and communications,www.bizlinktech.com,1,886 2 82261000,1
cosumar sa,morocco,"1,380","8 rue mouatamid ibnou abbad, bp 3098 roches noires, casablanca",consumer packaged goods,www.cosumar.co.ma,1,212 52 2678300,1
clas ohlson ab,sweden,"3,186","insjon, leksand, 79385",retailing,www.clasohlson.com/se,410,46 247 44400,1
mediaset espana comunicacion sa,spain,"1,587","carretera de fuencarral a alcobendas, n 4, madrid, 28049",media,www.mediaset.es,1,34 913 966300,1
la doria spa,italy,810,"via nazionale, 320, angri, 84012",consumer packaged goods,www.gruppoladoria.it,,39 081 5166111,1
enova international inc,united states of america,"1,463","175 w jackson blvd ste 1000, chicago, illinois, 60604-2863",financial services,www.enova.com,1,1 312 5684200,1
pt pabrik kertas tjiwi kimia tbk,indonesia,"5,300","sinar mas land plaza, menara 2, lt.5 jl. mh. thamrin no 51, jakarta pusat, 10350",paper and packaging,tjiwikimia.co.id,1,62 21 29650800,1
aenza saa,peru,"33,169","av. paseo de la republica n 4675, lima, 15047",construction,www.aenza.com.pe,182,51 1 2136565,1
neenah inc,united states of america,"2,493","3460 preston ridge rd, alpharetta, georgia, 30005-2058",paper and packaging,www.neenah.com,561,1 678 5666500,1
bystronic ag,switzerland,"3,636","giesshuebelstrasse 45, zuerich, 8045",industrial goods and machinery,www.bystronic.com,1,41 44 4682449,1
essent group ltd,bermuda,350,"61 front street, 2 church street, hamilton, hm11",financial services,essentgroup.com,4,1 441 2979901,1
datadog inc,united states of america,"3,200","620 eighth avenue, 45th floor, new york, 10018",technology and communications,www.datadoghq.com,22,1 917 5126452,1
zhejiang huahai pharmaceutical co ltd,china,"7,019","xunqiao, linhai city, taizhou, zhejiang, 317024",pharmaceuticals and healthcare,www.huahaipharm.com,4,8657685991096,1
shenzhen kingdom sci-tech co ltd,china,"8,888","8-9f, kingdom technology mansion, gaoxin south fifth ave,south section, hi-tech zone, nanshan district, shenzhen, guangdong, 518057",technology and communications,www.szkingdom.com,1,86 755 86393989,1
rws holdings plc,united kingdom,"7,796","chiltern hill, test city, new postcode, chalfont st peter, sl99fg",business and consumer services,www.rws.com,1,44 1753 480200,1
megaworld corp,philippines,924,"28/f the world centre, 330 sen. gil puyat avenue, manila, 1634",construction,www.megaworldcorp.com,1,63 2 88946431,1
choice properties real estate investment trust,canada,298,"22 st. clair avenue east, suite 500, toronto, ontario, m4t2s5",construction,www.choicereit.ca,3,1 416 9606990,1
abiomed inc,united states of america,"2,003","22 cherry hill dr, danvers, massachusetts, 01923-2575",medical equipment,www.abiomed.com,,1 978 7775410,1
yelp inc,united states of america,"4,400","10th floor, 350 mission street, san francisco, california, 94105",technology and communications,www.yelp.com,2,1 303 7962850,1
first resources ltd,singapore,"8,066","8 temasek boulevard,  36-02 suntec tower three, singapore, 038988",agriculture and forestry,www.first-resources.com,1,65 6 6020200,1
tien phong commercial joint stock bank,vietnam,"8,968","toa nha tpbank, so 57, pho ly thuong kie, phuong tran hung dao, quan hoan kiem, hanoi",financial services,tpb.vn,1,84 4 37683683,1
pt indocement tunggal prakarsa tbk,indonesia,"4,668","citeureup factory complex, jl. mayor oking jayaatmaja, bogor, 16810",construction,www.indocement.co.id,2,62 21 2512121,1
solutions 30 se,luxembourg,"7,487","3 rue de la reine, luxembourg, l2418",technology and communications,www.solutions30.com,245,,1
texwinca holdings ltd,hong kong,"10,903","16th floor, metroplaza, tower ii, 223 hing fong road, kwai chung, new territories, hong kong",retailing,www.texwinca.com,242,852  26107116,1
livanova plc,united kingdom,"3,000","20 eastbourne terrace, london, w26lg",medical equipment,www.livanova.com/home.action,3,44 20 33250662,1
tecan group ltd,switzerland,"3,291","seestrasse 103, maennedorf, 8708",medical equipment,www.tecan.com,5,41 44 9228111,1
makalot industrial co ltd,taiwan,"23,773","6th floor, no. 106-2, section 2, chung shan north road, jhongshan dist., taipei, 110",textiles,www.makalot.com.tw,1,886 2 23455588,1
container corporation of india ltd,india,"1,359","nsic new mdbp building, 3rd floor, okhla industrial estate, new delhi, 110020",transport and logistics,www.concorindia.com,5,91 11 41222500,1
datwyler holding inc,switzerland,"8,679","gotthardstrasse 31, altdorf, 6460",industrial goods and machinery,www.datwyler.com,2,41 41 8751100,1
aker asa,norway,"2,358","oksenoyveien 10, lysaker, 1366",energy and utilities,www.akerasa.com,5,47 2 4130000,1
cognex corp,united states of america,"2,257","one vision drive, natick, massachusetts, 01760",technology and communications,www.cognex.com,8,1 508 6503000,1
odfjell se,norway,"2,299","postterminalen, conrad mohrsv. 29, p.o. box 6101, bergen, 5892",transport and logistics,www.odfjell.com,744,47 55 270000,1
mitsubishi research institute inc,japan,"4,235","2-10-3, nagata-cho, chiyoda-ku, tokyo, 100-8141",technology and communications,www.mri.co.jp,619,81 3 51572111,1
nien made enterprise co ltd,taiwan,"7,664","23f-1, no.98, shizheng north, 7th road, xitun district, taichung, 407",consumer packaged goods,www.nienmade.com.tw,3,886 43 6000999,1
gcc sab de cv,mexico,"3,028","avenida vicente suarez y calle sexta, s/n zona industrial nombre de dios, chihuahua, 31105",construction,www.gcc.com,2,52 614 4423100,1
enviva inc,united states of america,"1,196","7272 wisconsin ave., suite 1800, bethesda, maryland, 20814",alternative energy,www.envivabiomass.com,3,1 301 6575560,1
fastighets ab balder,sweden,"1,139","parkgatan 49, goeteborg, 41138",construction,www.balder.se,6,46 31 109570,1
partner communications co ltd,israel,"2,588","8 amal street,  afeq industrial park, p.o. box 435, rosh ha'ayin, 4809229",technology and communications,www.partner.co.il,1,,1
the hiroshima bank ltd,japan,"3,439","1-1-7 nishikaniya, minami-ku, minami-ku, hiroshima-shi, 732-0804",financial services,www.hirogin-hd.co.jp/,,81 82 2455151,1
lacto japan co ltd,japan,323,"8-15 nihonbashi honcho 4-chome, 3rd floor neo kawai building, chuo-ku, tokyo, 103-0027",consumer packaged goods,www.lactojapan.com,151,81 3 62143831,1
covenant logistics group inc,united states of america,"4,500","400 birmingham hwy, chattanooga, tennessee, 37419-2346",transport and logistics,www.covenantlogistics.com,486,1 423 8211212,1
gentherm inc,united states of america,"10,474","21680 haggerty rd, northville, michigan, 48167-8994",automotive,www.gentherm.com,2,1 248 5040500,1
vueling airlines sa,spain,"3,969","vilaadecans business park, edif. brasil, carrer de catalunya, 83, barcelona , 08840",transport and logistics,www.vueling.com,,34 93 3787878,1
csg systeinternational inc,united states of america,"5,200","10th floor, 6175 south willow drive, greenwood village, colorado, 80111",technology and communications,www.csgi.com,1,1 303 2002000,1
nihon parkerizing co ltd,japan,"4,353","1-15-1, nihombashi, chuo-ku, tokyo, 103-0027",chemicals,www.parker.co.jp,969,81 3 32784333,1
unionbank of the philippines,philippines,"3,676","unionbank plaza, ortigas center, meralco avenue cor.onyx & sapphire roads, pasig, 1605",financial services,www.unionbankph.com,3,63 2 86676388,1
bgi genomics co ltd,china,"4,333","ole maaloees vej 3, copenhagen n, shenzhen, guangdong, 518083",medical equipment,www.bgi.com,3,86 755 36307065,1
banco de occidente,colombia,"3,353","carrera 13 no. 27-47, bogota",financial services,www.bancodeoccidente.com.co,952,57 1 7464000,1
proofpoint inc,united states of america,"3,658","925 west maude avenue, sunnyvale, california, 94085",technology and communications,www.proofpoint.com,,1 408 5174710,1
ocwen financial corp,united states of america,"5,700","1661 worthington rd ste 100, west palm beach, florida, 33409-6493",financial services,www.ocwen.com,262,1 561 6828000,1
s&b foods inc,japan,"2,122","18-6, nihombashi kabuto-cho, chuo-ku, tokyo, 103-0026",consumer packaged goods,www.sbfoods.co.jp,371,81 3 36680551,1
mixi inc,japan,"1,452","36f, scramble square, 2-24-12, shibuya, shibuya-ku, tokyo, 150-6136",technology and communications,mixi.co.jp,1,81 3 68979500,1
hanmi pharmaceuticals co ltd,south korea,"2,095","214, muha-ro, paltan-myeon, hwaseong, 18536",pharmaceuticals and healthcare,www.hanmi.co.kr,2,82 31 3505600,1
the 77 bank ltd,japan,"2,754","3-3-20, chuo, aoba-ku, sendai-shi, miyagi, 980-8777",financial services,www.77bank.co.jp,1,81 22 2671111,1
the supreme industries ltd,india,"5,228","142-48, s. v. road, jogeshwari  west , mumbai, 400093",construction,www.supreme.co.in,3,91 22 67710000,1
merida industry co ltd,taiwan,"3,768","no.116, megan road, megan village, dacun, 515",leisure and arts,www.merida-bikes.com,1,886 48 526171,1
united arrows ltd,japan,"4,213","3-28-1, jingumae, shibuya-ku, tokyo, 150-0001",retailing,www.united-arrows.co.jp,399,81 3 57856325,1
amano corp,japan,"4,786","275, mamedo-cho, kohoku-ku, yokohama-shi, kanagawa, 222-8558",technology and communications,www.amano.co.jp,1,81 45 4011441,1
paycom software inc,united states of america,"5,385","7501 w memorial rd, oklahoma city, 73142-1404",technology and communications,www.paycom.com,18,1 405 7226900,1
softwareone holding ag,switzerland,"8,890","riedenmatt 4, stans, 6370",technology and communications,www.softwareone.com,2,,1
china aviation lithium battery co ltd,china,,"no. 1 jiangdong avenue, jintan district, changzhou, jiangsu, 213200",clean technology,www.calb-tech.com,4,86 379 60339688,1
osb group plc,united kingdom,"1,826","chatham maritime, osb house quayside, kent, me44qz",financial services,www.osb.co.uk,2,44 1634 848944,1
systex corp,taiwan,"4,363","no.318, rueiguang road, neihu district, taipei, 114",technology and communications,tw.systex.com,654,886 2 77201888,1
crown resorts ltd,australia,"11,500","level 3, crown towers, 8 whiteman street, southbank, melbourne, victoria, 3006",leisure and arts,www.crownresorts.com.au,,61 3 92928824,1
carrefoursa carrefour sabanci ticaret merkezi as,turkey,"11,154","carfrsa plza cvzli mh.tgy yl  cad, no:67a blok b maltepe, istanbul, 34846",retailing,www.carrefoursa.com,441,90 216 6550000,1
sao martinho sa,brazil,"7,869","fazenda sao martinho, s/nr., zona rural, pradopolis, 14.850-000",chemicals,www.saomartinho.com.br,1,55 16 39819000,1
kobelco eco-solutions co ltd,japan,"1,330","4-78, 1-chome, wakinohama-cho, chuo-ku, kobe-shi, hyogo, 651-0072",clean technology,www.kobelco-eco.co.jp,,81 78 2328018,1
tatung co ltd,taiwan,"32,222","no.22, section 3, chungshan north road, taipei, 104",technology and communications,www.tatung.com.tw,2,886 2 25925252,1
pt jasa marga persero tbk,indonesia,"8,049","plaza tol taman mini indah, jakarta, 13550",construction,www.jasamarga.com,1,62 21 8413630,1
db hitek co ltd,south korea,"2,004","90, sudo-ro, bucheon, 14519",technology and communications,www.dbhitek.co.kr,1,82 32 6804700,1
dah sing financial holdings ltd,hong kong,"3,014","36/f, everbright centre, 108 gloucester road, hong kong",financial services,www.dahsing.com/html/tc/about us/aboutus.html,830,852  25078866,1
cgg sa,france,"3,312","27 avenue carnot, paris, 91300",energy and utilities,www.cgg.com,605,33 1 64474500,1
omega healthcare investors inc,united states of america,70,"suite 3500, 200 international circle, hunt valley, maryland, 21030",construction,www.omegahealthcare.com,6,1 410 4271700,1
stockmann plc,finland,"6,449","aleksanterinkatu 52 b, pl 220, helsinki, 00100",retailing,www.stockmanngroup.com,355,358 9 1211,1
global industrial co,united states of america,"1,480","11 harbor park dr, port washington, new york, 11050",retailing,www.globalindustrial.com,952,1 516 6087000,1
zhaojin mining industry co ltd,china,"6,755","no. 118 wenquan road, zhaoyuan city, yantai, shandong , 265400",metals and mining,en.zhaojin.com.cn,3,86 535 8266009,1
brunel international nv,netherlands,"12,219","john m. keynesplein 33, amsterdam, 1066ep",business and consumer services,www.brunelinternational.net,550,31 20 3125000,1
islami bank bangladesh ltd,bangladesh,"19,193","islami bk tower, 40 dilkusha c/a, dhaka, 1000",financial services,www.islamibankbd.com,561,880 2 9563040,1
ijm corporation berhad,malaysia,"2,878","wisma ijm, jalan yong shook lin, selangor darul ehsan, 46050",construction,www.ijm.com,1,60 3 79858288,1
semirara mining and power corp,philippines,"3,943","2/f dmci bldg. pasong tamo extension, makati, 2281",metals and mining,www.semiraramining.com,2,63 88 83000,1
breville group ltd,australia,610,"u 2 170-180 bourke rd, alexandria, new south wales, 2015",consumer packaged goods,www.brevillegroup.com.au,2,61 2 93848100,1
sky perfect jsat holdings inc,japan,841,"akasaka intercity air, 1-8-1, akasaka, minato-ku, tokyo, 107-0052",technology and communications,www.skyperfectjsat.space/company/resume/sjh,1,81 3 55711500,1
united fire group inc,united states of america,"1,086","118 2nd ave se, cedar rapids, iowa, 52401-1212",financial services,www.ufginsurance.com,756,1 319 3995700,1
bahrain telecommunications co bsc,bahrain,"2,486","p.o.box 14, building 1095, block 1014, road 1425, hamala, manama, 1014",technology and communications,www.batelco.com,2,973 1 7881881,1
varta ag,germany,"4,712","varta-platz 1, ellwangen, 73479",alternative energy,www.varta-ag.com,1,49 7961 9210,1
ameris bancorp,united states of america,"2,865","suite 1550, 3490 piedmont road n.e., atlanta, georgia, 30305",financial services,www.amerisbank.com,3,1 404 6396500,1
jiangsu yuyue medical equipment & supply co ltd,china,"6,440","no. 1 baisheng road, development zone, danyang city, zhenjiang, jiangsu, 212300",medical equipment,www.yuyue.com.cn,4,86 511 86900876,1
asiainfo technologies ltd,china,"13,309","asiainfo plaza, dong qu, 10 xibeiwang dong lu, haidian district, beijing, 100193",technology and communications,www.asiainfo.com,1,,1
choice hotels international inc,united states of america,"1,500","suite 400, 1 choice hotels circle, rockville, maryland, 20850",leisure and arts,www.choicehotels.com/en-in,6,1 301 5925181,1
esprit holdings ltd,hong kong,"2,200","bei jiao ma bao dao 28 hao, hua hui zhong xin 27 lou, kowloon bay, hong kong",retailing,www.esprit.com,289,852  27654321,1
hisamitsu pharmaceutical co inc,japan,"2,784","30f, marunouchi bldg., 2-4-1, marunouchi, chiyoda-ku, tokyo, 100-6221",pharmaceuticals and healthcare,www.hisamitsu.co.jp,2,81 3 52931700,1
ohb se,germany,"3,077","manfred-fuchs-platz 2-4, bremen, 28359",aerospace and defense,www.ohb.de,642,49 421 20208,1
united bankshares inc,united states of america,"2,966","300 united center, , 500 virginia street e, charleston, west virginia, 25301",financial services,www.ubsi-inc.com,5,1 740 7351104,1
rea group ltd,australia,"3,103","511 church street, richmond, victoria, 3121",media,www.rea-group.com,11,61 3 98971121,1
austal ltd,australia,"5,000","100 clarence beach road, henderson, perth, 6166",transport and logistics,www.austal.com,452,61 8 94101111,1
oil search ltd,papua new guinea,"1,243","po box 842, port moresby, 121",energy and utilities,www.oilsearch.com,,675 3 225599,1
