name,headquarters,number_of_employees,address,industry,website,market_cap,telephone,revenue
ingenico sa,france,"20,000","28-32 boulevard de grenelle, paris, ile-de-france, 75015",technology and communications,www.ingenico.com,,33 1 58018000,3
swiss steel holding ag,switzerland,"9,897","landenbergstrasse 11, lucerne, zurich, 6005",metals and mining,www.schmolz-bickenbach.com,734,41 41 5814000,3
kumagai gumi co ltd,japan,"4,338","2-1, tsukudo-cho, shinjuku-ku, tokyo, 162-8557",construction,www.kumagaigumi.co.jp,915,81 3 32602111,3
realtek semiconductor corp,taiwan,"2,774","no.2, innovation road ii, hsinchu science park, baoshan, 300",technology and communications,www.realtek.com,5,886 3 5780211,3
geberit ag,switzerland,"11,796","schachenstrasse 77, jona, 8645",construction,www.geberit.com,19,41 55 2216300,3
naval group,france,"17,015","40-42, rue du docteur finlay, paris, ile-de-france, 75732",aerospace and defense,www.naval-group.com,,33 1 40595000,3
asiana airlines inc,south korea,"9,125","443-83, ojeong-ro, gangseo-gu, seoul, 07505",transport and logistics,www.flyasiana.com,926,82 2 26693114,3
yale new haven hospital inc,united states of america,"15,442","20 york street, new haven, connecticut, 06510-3202",pharmaceuticals and healthcare,www.ynhh.org,,1 203 6884242,3
besix group sa,belgium,"12,000","avenue des communautes 100, woluwe-saint-lambert, bruxelles-capitale , 1200",construction,www.besix.com,,32 2 4026211,3
ks ag,germany,"11,045","bertha-von-suttner-strasse 7, kassel, hessen, 34131",chemicals,www.kpluss.com,4,4956193010,3
gjensidige forsikring asa,norway,"4,153","schweigaards gate 21, oslo, 0191",financial services,www.gjensidige.no,9,,3
nishi-nippon railroad co ltd,japan,"18,576","3-5-7, hakata ekimae, hakata-ku, fukuoka-shi, 812-0011",transport and logistics,www.nishitetsu.co.jp,1,81 92 7341553,3
pinnacle west capital corporation,united states of america,91,"400 north fifth street, ms 8695, phoenix, arizona, 85004",power,www.pinnaclewest.com,8,1 602 2501000,3
brinker international inc,united states of america,"62,025","3000 olympus blvd., dallas, texas, 75019",leisure and arts,www.brinker.com,1,1 972 9809917,3
clean harbors inc,united states of america,"18,300","42 longwater drive, p.o. box 9149, norwell, massachusetts, 02061",environmental and waste management services,www.cleanharbors.com,6,1 781 7925000,3
de'longhi spa,italy,"9,358","via lodovico seitz, 47, treviso, veneto, 31100",consumer packaged goods,www.delonghigroup.com,3,39 0422 4131,3
regal rexnord corp,united states of america,"30,000","200 state st, beloit, wisconsin, 53511",industrial goods and machinery,www.regalrexnord.com,8,1 608 3648800,3
applied industrial technologies inc,united states of america,"6,100","one applied plaza, cleveland, ohio, 44115",industrial goods and machinery,www.applied.com,4,1 216 4264000,3
plexus corp,united states of america,"19,200","one plexus way, plexus corp, neenah, wisconsin, 54956",technology and communications,www.plexus.com/en-us,3,1 920 9696000,3
shimadzu corp,japan,"13,499","1, kuwabara-cho, nishinokyo, nakagyo-ku, kyoto-shi, 604-8511",medical equipment,www.shimadzu.co.jp,8,81 75 8231111,3
jgc holdings corp,japan,"7,275","6f, new ohtemachi bldg., 2-2-1, ote-machi, yokohama-shi, kanagawa, 220-6001",construction,www.jgc.com,3,81 45 6821111,3
askul corp,japan,"3,380","11f, toyosu cubic garden, 3-2-3, toyosu, koto-ku, tokyo, 135-0061",consumer packaged goods,www.askul.co.jp,1,81 3 43305001,3
sally beauty holdings inc,united states of america,"29,000","3001 colorado blvd, denton, texas, 76210",retailing,www.sallybeautyholdings.com,1,1 940 8987500,3
godaddy inc,united states of america,"6,611","2155 e. godaddy way, tempe, arizona, 85284",technology and communications,investors.godaddy.net,12,1 480 5058800,3
yageo corp,taiwan,,"3f, no. 233-1, pao chiao road, xindian district, new taipei, 231",industrial goods and machinery,www.yageo.com,7,886 2 66299999,3
sensata technologies holding plc,united states of america,"21,300","529 pleasant street, attleboro, massachusetts, 02703",automotive,investors.sensata.com,6,1 508 2363800,3
china shanshui cement group ltd,china,"17,699","shanshui industrial park, gushan town, changqing district, ji'nan, shandong , 250307",construction,www.shanshuicement.com,902,86 531 88360218,3
guangdong investment ltd,hong kong,"10,530","28/f-29/f flors,guangdong invt, 148 connaught rd, central, hong kong",construction,www.gdi.com.hk,7,852  28604368,3
agnico eagle mines ltd,canada,"6,810","suite 400, 145 king street east, toronto, ontario, m5c2y7",metals and mining,www.agnicoeagle.com,24,1 416 9471212,3
ventas inc,united states of america,434,"suite 3300, 353 n. clark street, chicago, illinois, 60654",construction,www.ventasreit.com,19,1 312 6603800,3
intertek group plc,united kingdom,"44,063","33 cavendish square, london, w1g0ps",business and consumer services,www.intertek.com,8,44 20 73963400,3
taiwan cement corp,taiwan,"10,409","no.113, section 2, zhongshan north road, taipei, 104",construction,www.taiwancement.com,8,886 2 25317099,3
meritor inc,united states of america,"9,600","2135 w maple rd, troy, michigan, 48084",automotive,www.meritor.com,,1 248 4351000,3
lianhua supermarket holdings co ltd,china,"29,448","5th to 14th floors, no.1258 zhen guang road, shanghai, 200333",retailing,lianhua.todayir.com,63,86 21 52629922,3
kewpie corp,japan,"10,719","1-4-13, shibuya, shibuya-ku, tokyo, 150-0002",consumer packaged goods,www.kewpie.co.jp,2,81 3 34863331,3
benesse holdings inc,japan,"16,515","3-7-17, minamigata, kita-ku, okayama-shi, 700-0807",business and consumer services,www.benesse-hd.co.jp,1,81 86 2251165,3
gs yuasa corp,japan,"13,571","1, inobanba-cho, nishinosho, kisshoin, minami-ku, kyoto-shi, 601-8520",automotive,www.gs-yuasa.com/jp,1,81753121211,3
chicony electronics co ltd,taiwan,,"no. 25, wu kung 6th road, wugu district, new taipei, 241",technology and communications,www.chicony.com.tw,2,886 2 66266788,3
elkem asa,norway,"7,178","drammensveien 169, oslo, 0277",chemicals,www.elkem.com,2,47 2 2450100,3
schouw & co as,denmark,"11,315","chr. filtenborgs plads 1, aarhus, 8000",consumer packaged goods,www.schouw.dk,1,,3
the nisshin oillio group ltd,japan,"2,987","1-23-1, shinkawa, chuo-ku, tokyo, 104-8285",consumer packaged goods,www.nisshin-oillio.com,818,81 3 32065005,3
enovis corp,united states of america,"16,200","2711 centerville road, suite 400, wilmington, delaware, 19808",industrial goods and machinery,www.enovis.com,3,1 302 2529160,3
fuji oil holdings inc,japan,"5,623","daibiru honkan bldg., 3-6-32, nakanoshima, kita-ku, osaka-shi, 530-0005",ingredients,www.fujioilholdings.com,1,81 6 64590700,3
siliconware precision industries co ltd,taiwan,"22,632","no. 123, section 3, da fong road, tantzu, taichung, 427",technology and communications,www.spil.com.tw,,886 4 25341525,3
el sewedy electric co,egypt,"14,986","plot no. 27, , 1st district, 5th settlement, p.o.box 311, cairo, 11853",power,www.elsewedyelectric.com,943,20 2 27599700,3
cie automotive sa,spain,"24,484","alameda mazarredo 69, 8, bilbao, vizcaya, 48009",automotive,www.cieautomotive.com,3,34 946 054835,3
masan group corp,vietnam,"34,560","room 802, 8th floor,central plaza bldg., 17 le duan, district 1, ho chi minh",consumer packaged goods,masangroup.com,6,84 8 62563862,3
turk telekomunikasyon as,turkey,"9,932","ornek mahallesi turgut ozal bulvari 2, no:4, aydinlikevler, ankara, 06103",technology and communications,www.turktelekom.com.tr,4,90 212 3099630,3
foshan haitian flavoring food co ltd,china,"6,678","no. 16, wensha road, foshan, guangdong, 528000",ingredients,www.haitian-food.com,56,86 757 82836083,3
edom technology co ltd,taiwan,621,"8th floor, no.50, lane 10, jihu rd., neihu district, taipei, 114",technology and communications,www.edomtech.com,239,886 2 26578811,3
wallenius wilhelmsen asa,norway,"7,490","strandveien 20, lysaker, 1366",transport and logistics,www.walleniuswilhelmsen.com,4,47 67 825700,3
kuka ag,germany,"14,762","zugspitzstrasse 140, augsburg, 86165",industrial goods and machinery,www.kuka.com/de-de,,49 821 79750,3
terex corp,united states of america,"8,600","45 glover avenue, 4th floor, norwalk, connecticut, 6850",industrial goods and machinery,www.terex.com,3,1 203 2227170,3
burberry group plc,united kingdom,"9,293","horseferry house, horseferry road, westminster, london, sw1p2aw",retailing,www.burberryplc.com/en/index.html,10,44 20 34021444,3
sapporo holdings ltd,japan,"6,872","4-20-1, ebisu, shibuya-ku, tokyo, 150-8522",consumer packaged goods,www.sapporoholdings.jp,1,81 3 54237214,3
marriott vacations worldwide corp,united states of america,"20,300","9002 san marco court, orlando, florida, 32819",leisure and arts,www.marriottvacationsworldwide.com,5,1 407 2066000,3
israel discount bank ltd,israel,"8,036","p.o.b. 456, 27-31 yehuda halevy st, tel aviv-yafo, 6513601",financial services,www.discountbank.co.il,6,972 3 9439111,3
snam spa,italy,"3,568","piazza santa barbara, 7, san donato milanese, 20097",energy and utilities,www.www.eleveit.it/snam.it,18,39 02 5201,3
modec inc,japan,"5,173","4f/5f, nihonbashi maruzen tokyu bldg, 2-3-10, nihonbashi, chuo-ku, tokyo, 103-0027",energy and utilities,www.modec.com,612,81 3 52901200,3
titan company ltd,india,"7,263","3, sipcot industrial complex, bangalore, 560100",consumer packaged goods,www.titan.co.in,26,91 80 67047000,3
cofco sugar holding co ltd,china,"6,385","20f, merchants bank mansion, no. 2 huanghe road, beijing, 100020",consumer packaged goods,www.cofcotunhe.com,2,86 10 85631055,3
guosen securities co ltd,china,"12,003","guosen securities mansion, no. 1012 hongling middle road, shenzhen, guangdong, 518046",financial services,www.guosen.com.cn,13,86 755 82130188,3
diebold nixdorf inc,united states of america,"22,000","50 executive parkway, hudson, ohio, 44236",technology and communications,www.dieboldnixdorf.com,171,1 330 4904000,3
uni-president china holdings ltd,china,"33,593","no. 131, linhong road, shanghai hongqiao linkong economic zone, changning district, 200335",consumer packaged goods,www.uni-president.com.cn,4,86 21 22158888,3
industries qatar,qatar,"3,764","west bay area, p.o. box 3212, doha",chemicals,iq.com.qa,22,974  40132080,3
national bank of kuwait,kuwait,"7,511","abdulla al-ahmad street,  safat, p.o. box 95, kuwait city, 13001",financial services,www.nbk.com,26,965 224 22011,3
atkore inc,united states of america,"4,000","16100 south lathrop avenue, harvey, illinois, 60426",construction,investors.atkore.com,4,1 708 3391610,3
heiwado co ltd,japan,"5,324","1, nishiima-cho, hikone-shi, shiga, 522-8511",retailing,www.heiwado.jp,843,81 749 233111,3
sto express co ltd,china,"9,146","no. 58, zhongda road, qingpu district, shanghai, 201706",transport and logistics,www.sto.cn,2,86 21 60376669,3
shenzhen mindray bio-medical electronics co ltd,china,"14,684","1-4f, mindray mansion, technology south, high-tech technology industrial park, shenzhen, guangdong, 518057",medical equipment,www.mindray.com/en,60,86 755 81888398,3
xinyi glass holdings ltd,hong kong,"14,798","unit 2101-2108, 21st floor,  rykadan cap, 135 hoi bun road, kwun tong kowloon",industrial goods and machinery,www.xinyiglass.com,8,852  39192888,3
cargotec oyj,finland,"11,525","porkkalankatu 5, helsinki, 00180",industrial goods and machinery,www.cargotec.com,2,358 2 07774000,3
daewoo shipbuilding & marine engineering co ltd,south korea,"13,199","3370, geoje-daero, 53302",transport and logistics,www.dsme.co.kr,1,82 55 7352114,3
joint stock commercial bank for foreign trade of vietnam,vietnam,"22,370","198 tran quang khai, phuong ly thai to, quan hoan kiem, hanoi",financial services,portal.vietcombank.com.vn,18,84 4 39343137,3
ambuja cements ltd,india,"4,418","elegant business park, midc cross road 'b', off andheri-krla rd, andheri  e , mumbai, 400059",construction,www.ambujacement.com,12,91 22 66167000,3
the scotts miracle-gro co,united states of america,"2,430","14111 scottslawn rd, marysville, ohio, 43040-7800",consumer packaged goods,scottsmiraclegro.com,3,1 937 6440011,3
pldt inc,philippines,"17,620","ramon conjuangco bldg, makati ave, 0721",technology and communications,pldthome.com,5,63 2 8888171,3
matson inc,united states of america,"4,259","1411 sand island pkwy, honolulu, hawaii, 96819",transport and logistics,www.matson.com,2,18088481211,3
kohnan shoji co ltd,japan,"4,283","2-2-17, nishimiyahara, yodogawa-ku, osaka-shi, 532-0004",retailing,www.hc-kohnan.com,877,81 6 63971621,3
american water works co inc,united states of america,"6,400","1 water street, camden, new jersey, 08102-1658",clean technology,www.amwater.com,27,1 609 3468200,3
jiangsu yanghe brewery jsc ltd,china,"17,956","no. 118, jiudu avenue, yanghe, suqian, jiangsu, 223800",consumer packaged goods,www.chinayanghe.com,40,86 527 84938128,3
brown-forman corp,united states of america,"5,200","850 dixie highway, louisville, kentucky, 40210",consumer packaged goods,www.brown-forman.com,31,1 502 5851100,3
hitachi zosen corp,japan,"11,540","1-7-89, nanko-kita, suminoe-ku, osaka-shi, 559-8559",industrial goods and machinery,www.hitachizosen.co.jp,1,81 6 65690001,3
suzhou gold mantis construction decoration co ltd,china,"14,493","no. 888, west ring road, suzhou, jiangsu, 215004",construction,www.goldmantis.com/jtl2013/cn/home.asp,2,86 512 68660622,3
premium brands holdings corp,canada,"11,676","100-10991 shellbridge way, richmond, british columbia, v6x3c6",consumer packaged goods,www.premiumbrandsholdings.com,3,1 604 6563100,3
porto seguro sa,brazil,"13,000","alameda barao de piracicaba, 618/634 - torre b, sao paulo, 01.216-012",financial services,www.portoseguro.com.br,3,55 11 23937195,3
dragerwerk ag & co kgaa,germany,"16,252","moislinger allee 53-55, luebeck, 23558",medical equipment,www.draeger.com,798,49 451 8820,3
bel sa,france,"11,757","2 allee de longchamp, suresnes, ile-de-france, 92150",consumer packaged goods,www.groupe-bel.com,,33 1 84027250,3
api group corp,united states of america,"13,300","1100 old highway 8 north west, new brighton, minnesota, 55112",construction,www.apigroupinc.com,4,1 651 6364320,3
asian paints ltd,india,"7,423","asian paints house, 6a, shantinagar, santacruz  east , mumbai, 400055",chemicals,www.asianpaints.com,34,91 22 39818000,3
millerknoll inc,united states of america,"11,300","855 east main avenue, zeeland, michigan, 49464",consumer packaged goods,hermanmiller.com,1,1 616 6543000,3
american national group inc,united states of america,"4,545","one moody plaza, galveston, texas, 77550-7999",financial services,www.americannational.com/wps/portal,,1 409 7634661,3
momentum metropolitan holdings ltd,south africa,"16,558","268 west avenue, centurion, 0157",financial services,www.momentummetropolitan.co.za,1,27 12 6718911,4
align technology inc,united states of america,"22,540","410 north scottsdale road, suite 1300, tempe, arizona, 85288",medical equipment,www.aligntech.com,19,1 408 4701000,4
spirit aerosysteholdings inc,united states of america,"16,100","3801 south oliver, wichita, kansas, 67210",aerospace and defense,www.spiritaero.com,3,1 316 5269000,4
dcm holdings co ltd,japan,"4,025","omori bellport e bldg., 6-22-7, minami-oi, shinagawa-ku, tokyo, 140-0013",retailing,www.dcm-hc.co.jp,1,81 3 57645211,4
hopson development holdings ltd,hong kong,"10,734","suites 3305-3309,33rd f,jardine house, 1 connaught place, central, hong kong",construction,www.hopson.com.cn,3,852  25373086,4
japan pulp and paper co ltd,japan,"4,097","forefront tower, 3-12-1, kachidoki, chuo-ku, tokyo, 104-8656",paper and packaging,www.kamipa.co.jp,558,81 3 35348522,4
etihad etisalat company,saudi arabia,,"mobily c1 alyabis building 3rd floor, p.o.box 9979, riyadh, 11423",technology and communications,www.mobily.com.sa,7,966 1 12735050,4
toshiba tec corp,japan,"18,539","gate city ohsaki west tower, 1-11-1, osaki, shinagawa-ku, tokyo, 141-8562",technology and communications,www.toshibatec.co.jp,1,81 3 68309100,4
tryg a/s,denmark,"6,475","klausdalsbrovej 601, ballerup, 2750",financial services,tryg.com,15,,4
grandvision nv,netherlands,"39,000","the base, tower c, 6th floor, evert van de beekstraat 1-80, schiphol, 1118cl",retailing,www.grandvision.com,,31 88 8870100,4
china galaxy securities co ltd,china,"12,861","2-6f, no.35 finance street, xicheng district, beijing, 100073",financial services,www.chinastock.com.cn,11,86 10 80926608,4
cachet pharmaceutical co ltd,china,"3,149","no. 1 building, beijing, 100195",retailing,www.cachet.com.cn,628,86 10 88433464,4
d'ieteren sa/nv,belgium,"2,040","rue du mail 50, bruxelles, 1050",automotive,www.dieterengroup.com,10,32 2 5365111,4
stadler rail ag,switzerland,"13,092","ernst-stadler-strasse 1, bussnang, 9565",transport and logistics,www.stadlerrail.com,4,41 71 6262120,4
keyera corp,canada,"1,005","sunlife plaza 1, 144 4 ave sw suite 200, calgary, alberta, t2p3n4",energy and utilities,www.keyera.com,5,1 403 2057670,4
mannai corp,qatar,"2,000","salwa road ramada junction, p.o. box 76, doha",business and consumer services,mannai.com,974,974  44558888,4
prada spa,italy,"12,985","via antonio fogazzaro, 28, milano, 20135",retailing,www.prada.com/it/it,14,39  2541921,4
arcbest corp,united states of america,"14,000","8401 mcclure drive, fort smith, arkansas, 72916",transport and logistics,arcb.com,1,1 479 7856000,4
hulic co ltd,japan,"1,496","7-3, nihombashi odemma-cho, chuo-ku, tokyo, 103-0011",construction,www.hulic.co.jp,6,81 3 56238100,4
tri pointe homes inc,united states of america,"1,390","suite 200, 940 southwood blvd, incline village, nevada, 89451",construction,www.tripointehomes.com/,2,1 775 4131030,4
hellenic telecommunications organization sa,greece,"11,227","kifisias ave. 99, marousi, athens, 15124",technology and communications,www.cosmote.gr,6,30 21 06115381,4
xiamen international port co ltd,china,"7,212","22nd floor, no. 31 donggang north road, xiamen, fujian, 361013",transport and logistics,www.xipc.com.cn,,86 592 5829478,4
amn healthcare services inc,united states of america,"3,800","8840 cypress waters boulevard, suite 300, dallas, texas, 75019",business and consumer services,www.amnhealthcare.com,4,1 866 8718519,4
hindustan zinc ltd,india,"3,500","yashad bhawan, udaipur, 313004",metals and mining,www.hzlindia.com,18,91 294 6604000,4
mediobanca - banca di credito finanziario spa,italy,"5,016","piazzetta enrico cuccia, 1, milano, 20121",financial services,www.mediobanca.com,8,39 02 88291,4
biomerieux sa,france,"13,076","376, chemin de l'orme, craponne, 69280",medical equipment,www.biomerieux.fr,12,33 4 78872000,4
mercury general corp,united states of america,"4,300","4484 wilshire blvd, los angeles, california, 90010",financial services,www.mercuryinsurance.com,1,1 213 9371060,4
pt adaro energy tbk,indonesia,"9,849","jl. h.r. rasuna said, blok x-5, kav. 1-2, jakarta selatan, 12950",metals and mining,www.adaro.com,6,62 21 5211265,4
unibel sa,france,"11,800","2 allee de longchamp, suresnes, 92150",consumer packaged goods,www.unibel.fr,2,33 1 84027250,4
vorwerk & co kg,germany,"11,698","muehlenweg 17 - 37, wuppertal, nordrhein-westfalen, 42270",retailing,www.vorwerk.com,,49 202 5641208,4
hero motocorp ltd,india,"9,173","village malkumajra, nalagarh road,baddi, new delhi, 110057",automotive,www.heromotocorp.com/en-in,6,91 11 26142451,4
danieli & c officine meccaniche spa,italy,"8,959","via nazionale, 41, buttrio, 33042",construction,www.danieli.com,1,39 0432 1958111,4
acuity brands inc,united states of america,"13,200","suite 2300, 1170 peachtree street, ne, atlanta, georgia, 30309-7676",construction,www.acuitybrands.com,5,1 404 8531400,4
nws holdings ltd,hong kong,"13,800","28/f, new world tower, 18 queen's road central, central, hong kong",construction,www.nws.com.hk,3,852  21310600,4
tpg telecom ltd,australia,"5,000","level 1, 177 pacific highway, north sydney, new south wales, 2060",technology and communications,www.tpgtelecom.com.au,6,61 2 99644646,4
doosan infracore co ltd,south korea,"4,041","489, injung-ro, dong-gu, incheon, 22502",industrial goods and machinery,www.hyundai-di.com,1,82 32 2111114,4
jiangsu hengrui medicine co ltd,china,"24,491","no.7 kunlunshan road, lianyungang eco & tech development zone, jiangsu, 222000",pharmaceuticals and healthcare,www.hengrui.com,39,86 518 81220983,4
maroc telecom sa,morocco,"9,811","avenue annakhil. hay riad., rabat",technology and communications,www.iam.ma,8,212 53 7719039,4
qnb finansbank,turkey,"12,640","qnb finansbank, istanbul, 34394",financial services,www.qnbfinansbank.com,8,90 212 3185000,4
genpact ltd,bermuda,"109,600","canon's court, 22 victoria street, hamilton, hm12",technology and communications,www.genpact.com,8,1 441 2952244,4
banco santander rio sa,argentina,"4,770","av. juan de garay 151, buenos aires, 1036",financial services,www.santander.com.ar/banco/online/personas,,54 11 43411000,4
rohm co ltd,japan,"23,401","21, saiin mizosaki-cho, ukyo-ku, kyoto-shi, 615-8585",technology and communications,www.rohm.co.jp,8,81 75 3112121,4
shanghai zhenhua heavy industries co ltd,china,"8,250","no. 3261, dongfang road, shanghai, 200125",industrial goods and machinery,www.zpmc.com,2,86 21 50390727,4
anglogold ashanti ltd,south africa,"30,561","112 oxford road, houghton estate, johannesburg, 2198",metals and mining,www.anglogoldashanti.com,9,27 11 6376000,4
industrias bachoco sab de cv,mexico,"33,721","av. tecnologico n 401, ciudad industrial, celaya, 38010",consumer packaged goods,www.bachoco.com.mx,2,52 461 6183527,4
insistemas sa,spain,"54,933","avenida de bruselas, 35, alcobendas, madrid, 28108",technology and communications,www.indracompany.com,2,34 914 805000,4
atlas air worldwide holdings inc,united states of america,"4,056","2000 westchester ave, purchase, new york, 10577-2543",transport and logistics,www.atlasairworldwide.com,2,1 914 7018000,4
pan ocean co ltd,south korea,"1,964","10-14f, tower 8, 7, jong-ro 5-gil, jongno-gu, seoul, 03157",transport and logistics,www.panocean.com,2,82 2 3165114,4
grupo lala sab de cv,mexico,"40,258","parque industrial lagunero, gomez palacio, 35077",consumer packaged goods,www.lala.com.mx,,52 871 7293100,4
china nonferrous mining corporation ltd,china,"8,874","cnmc building, no. 10, anding road, chaoyang district, beijing, 100029",metals and mining,www.cnmcl.net,2,86 10 84426373,4
turkcell iletisim hizmetleri as,turkey,"18,999","maltepe, istanbul, 34430",technology and communications,www.turkcell.com.tr,4,90 212 3131000,4
oil india ltd,india,"6,256","plot no. 19, sector-16a, noida, dist. g b nagar, 201301",energy and utilities,www.oil-india.com,3,91 120 2488333,4
pricesmart inc,united states of america,"10,400","9740 scranton rd, san diego, california, 92121-1777",retailing,shop.pricesmart.com,2,1 858 4048800,4
rentokil initial plc,united kingdom,"46,000","riverbank, meadows business park, blackwater, camberley, gu179ab,",business and consumer services,www.rentokil-initial.com,16,44 1276 607444,4
brookfield renewable partners lp,bermuda,"2,875","fifth floor, 73 front street, hamilton, hm12",alternative energy,www.bep.brookfield.com,8,1 441 2943304,4
schroders plc,united kingdom,"5,358","1 london wall place, ec2y5au",financial services,www.schroders.com,9,44 20 76586000,4
georg fischer ag,switzerland,"14,957","amsler-laffon-strasse 9, schaffhausen, 8201",industrial goods and machinery,www.georgfischer.com,5,41 52 6311111,4
buzzi unicem spa,italy,"9,706","via luigi buzzi, 6, casale monferrato, 15033",construction,www.buzziunicem.it,4,39 0142 416111,4
banco de credito e inversiones sa,chile,"11,675","av. el golf 125, las condes",financial services,www.bci.cl,4,56 2 26927000,4
patrick industries inc,united states of america,"11,000","107 west franklin street, po box 638, elkhart, indiana, 46515",construction,patrickind.com,1,1 574 2947511,4
sartorius ag,germany,"16,038","otto-brenner-str. 20, goettingen, 37079",medical equipment,www.sartorius.de,30,49 551 3080,4
fiberhome telecommunication technologies co ltd,china,"16,388","no.6 gaoxin si road, donghu high-tech zone, wuhan, hubei, 430205",technology and communications,www.fiberhome.com,2,86 27 87693885,4
penta-ocean construction co ltd,japan,"3,667","2-8 koraku 2-chome, bunkyo-ku, tokyo, 112-8576",construction,www.penta-ocean.co.jp,1,81 3 38177181,4
oriental energy co ltd,china,"1,828","no.1 ziqi road, xuzhuang software park, xianlin avenue, nanjing, jiangsu, 210042",energy and utilities,www.chinadhe.com,2,86 25 86819806,4
international game technology plc,united kingdom,"10,500","second fl, marble arch house, 66 seymour street, london, w1h5bt",leisure and arts,www.igt.com,4,44 20 75353200,4
colliers international group inc,canada,"16,780","1140 bay street, suite 4000, toronto, ontario, m5s2b4",construction,www.collierscanada.com,4,1 416 9609500,4
arc resources ltd,canada,522,"calgary, 1200, 308 4th avenue sw, alberta, t2p0h7",energy and utilities,www.arcresources.com,7,1 403 5038770,4
mizrahi tefahot bank ltd,israel,"7,632","7 jaboutinsky st, ramat gan, 52136",financial services,www.mizrahi-tefahot.co.il,8,972 3 7559720,4
migros ticaret as,turkey,"44,142","ataturk mahallesi turgut ozal bulvari, no:7 atasehir, istanbul, 34758",retailing,www.migroskurumsal.com,1,90 216 5793000,4
lamb weston holdings inc,united states of america,"8,000","599 s rivershore ln, eagle, idaho, 83616-4979",consumer packaged goods,www.lambweston.com,14,1 208 9381047,4
zoom video communications inc,united states of america,"8,044","55 almaden boulevard, 6th floor, san jose, california, 95113",technology and communications,www.zoom.us,19,1 408 4838813,4
postnl nv,netherlands,"36,562","waldorpstraat 3, the hague, zuid-holland, 2521ca",transport and logistics,www.postnl.nl,1,31 88 8686161,4
texhong textile group ltd,hong kong,"37,061","unit 18, 7th floor, lippo sun plaza, hong kong",consumer packaged goods,www.texhong.com,805,852  28770225,4
cno financial group inc,united states of america,"3,350","11825 n pennsylvania st, carmel, indiana, 46032",financial services,www.cnoinc.com,2,1 317 8176100,4
