name,headquarters,number_of_employees,address,industry,website,market_cap,telephone,revenue
havells india ltd,india,"5,970","qrg towers, 2d, sector - 126, expressway, noida, 201304",consumer packaged goods,www.havells.com,9,91 120 4771000,1
sinch ab,sweden,"3,547","lindhagensgatan 74, stockholm, 11218",technology and communications,www.sinch.com,4,46 8 44682803,1
halfords group plc,united kingdom,"11,512","drive/washford west, icknield street drive, redditch, b980de",automotive,www.halfordscompany.com,486,44 1527 517601,1
arab national bank,saudi arabia,"4,059","po box 56921, riyadh, 11564",financial services,www.anb.com.sa,11,966 1 14029000,1
the navigator co sa,portugal,"3,218","mitrena, apartado 55, po box 55, setubal, 2901-861",paper and packaging,www.thenavigatorcompany.com,2,351 265 709000,1
eqt ab,sweden,"1,471","regeringsgatan 25, stockholm, 11153",financial services,www.eqtgroup.com,27,46 8 50655300,1
california resources corp,united states of america,970,"1 world trade center, suite 1500, long beach, california, 90831",energy and utilities,www.crc.com,3,1 310 2088800,1
zur rose group ag,switzerland,"2,131","walzmuehlestrasse 60, frauenfeld, 8500",retailing,www.zurrosegroup.com,486,41 52 7240020,1
tate & lyle plc,united kingdom,"4,591","1 kingsway, london, wc2b6at",consumer packaged goods,www.tateandlyle.com,3,44 20 72572100,1
willscot mobile mini holdings corp,united states of america,"4,700","4646 e. van buren street, suite 400, phoenix, arizona, 85008",business and consumer services,www.willscotmobilemini.com,9,1 480 8946311,1
piramal enterprises ltd,india,"13,561","piramal ananta, agastya corporate park, opposite fire brigade, kamani junction, lbs marg, kurla  west , mumbai, maharashtra, 400070",financial services,www.piramal.com,2,91 22 38023000,1
healthpeak properties inc,united states of america,196,"5050 south syracuse street, suite 800, denver, colorado, 80237",construction,www.healthpeak.com,14,1 949 4070700,1
interpump group spa,italy,"8,692","via e. fermi, 25, sant'ilario d'enza, 42049",industrial goods and machinery,www.interpumpgroup.it,5,39 0522 904311,1
the hain celestial group inc,united states of america,"3,078","1111 marcus ave, lake success, new york, 11042-1221",consumer packaged goods,www.hain.com,1,1 516 5875000,1
the wendys co,united states of america,"14,500","one dave thomas blvd, dublin, ohio, 43017",leisure and arts,www.wendys.com,4,1 614 7643100,1
octopus energy ltd,united kingdom,,"uk house, 5th floor, 164-182 oxford street, london, greater london, w1d1nn",power,www.octopus.energy,,,1
banco do nordeste sa,brazil,"6,598","av. dr. silas munguba,5.700, passare, fortaleza, 60.743-902",financial services,www.bnb.gov.br,1,55 85 32993000,1
bank audi sal,lebanon,"3,180","bank audi plaza, bab idriss, p.o. box 11-2560, beirut, 20218102",financial services,www.bankaudigroup.com,906,961 1 994000,1
intercorp financial services inc,peru,"7,378","5th floor, urbanizacion santa catalina, la victoria",financial services,www.ifs.com.pe,2,51 1 6159011,1
the japan steel works ltd,japan,"5,329","gate city osaki-west tower, 1-11-1, osaki, shinagawa-ku, tokyo, 141-0032",industrial goods and machinery,www.jsw.co.jp,1,81 3 57452001,1
altra industrial motion corp,united states of america,"9,600","suite 201, 300 granite street, braintree, massachusetts, 02184",industrial goods and machinery,www.altramotion.com,3,1 781 9170600,1
guoco group ltd,hong kong,"10,000","50th floor, the center, 99 queen's road central, hong kong",leisure and arts,www.guoco.com,3,852  22838833,1
zenith bank plc,nigeria,"8,152","plot 84, ajose adeogun street, victoria island",financial services,www.zenithbank.com,1,234 1 2787000,1
hartalega holdings berhad,malaysia,"9,040","c-g-9, 1 jalan dataran sd, kuala lumpur, 52200",industrial goods and machinery,hartalega.com.my,1,60 3 62771733,1
covanta holding corp,united states of america,"4,000","445 south st, morristown, new jersey, 07960-6475",power,www.covanta.com,2,1 862 3455000,1
east west bancorp inc,united states of america,"3,100","135 n. los robles ave. 7th floor, pasadena, california, 91101",financial services,investor.eastwestbank.com,9,1 626 7686000,1
keisei electric railway co ltd,japan,"10,855","3-3-1, yawata, ichikawa-shi, chubu , 272-8510",transport and logistics,www.keisei.co.jp,4,81 47 7127000,1
shikun & binui ltd,israel,"8,201","1a ha'yarden st., p.o.b 1133, airport city, lod, 7019900",construction,www.shikunbinui.co.il,1,972 3 6301111,1
ansys inc,united states of america,"5,100","2600 ansys drive, canonsburg, pennsylvania, 15317",technology and communications,www.ansys.com,21,1 844 4626797,1
life healthcare group holdings ltd,south africa,"15,436","oxford manor, 21 chaplin road, illovo, johannesburg, 2196",pharmaceuticals and healthcare,www.lifehealthcare.co.za,1,27 11 2199000,1
pierre & vacances sa,france,"12,211","11 rue de cambrai, l'artois, espace pont de flandre, paris cedex 19, 75947",leisure and arts,www.groupepvcp.com,657,33 1 58215821,1
superior plus corp,canada,"4,443","401-200 wellington st w, toronto, ontario, m5v3c7",energy and utilities,www.superiorplus.com,1,1 416 3406015,1
aica kogyo co ltd,japan,"4,949","2288, nishi-horie, nagoya-shi, aichi, 450-6326",construction,www.aica.co.jp,1,81 52 5333131,1
mednax inc,united states of america,"2,725","1301 concord terrace, sunrise, florida, 33323",pharmaceuticals and healthcare,www.mednax.com,1,1 954 3840175,1
oracle corporation japan,japan,"2,430","oracle aoyama center, 2-5-8, kita-aoyama, minato-ku, tokyo, 107-0061",technology and communications,www.oracle.com/jp,8,81 3 68346666,1
zhongbai holdings group co ltd,china,"19,182","no. 630, xinhua road, jianghan district, wuhan, hubei, 430024",retailing,www.whzb.com,512,86 27 82833891,1
intelsat sa,luxembourg,"1,080","4 rue albert borschette, luxembourg city, l-1246",technology and communications,www.intelsat.com,,352 27 841600,1
godrej industries ltd,india,"1,069","eastern express highway, pirojshanagar, vikhroli, mumbai, 400079",conglomerate,www.godrejindustries.com,1,91 22 25188010,1
liaoning port co ltd,china,"11,227","xingang commercial manison, dayaowan, dalian free trade zone, liaoning , 116600",transport and logistics,www.dlport.cn,4,86 411 87599899,1
valora holding ag,switzerland,"3,570","hofackerstrasse 40, muttenz, 4132",retailing,www.valora.com,1,41 61 4672020,1
britannia industries ltd,india,"4,467","airport road  old , britannia gardens, vimanapura, bangalore, 660048",consumer packaged goods,britannia.co.in,13,91 80 37687486,1
the children's place inc,united states of america,"3,500","500 plaza dr, secaucus, new jersey, 07094-3619",retailing,corporate.childrensplace.com,471,1 201 5582400,1
nissan shatai co ltd,japan,"4,016","2-1, tsutsumi-cho, hiratsuka-shi, kanagawa, 254-8610",automotive,www.nissan-shatai.co.jp,1,81 46 3218001,1
new hope corp ltd,australia,873,"level 16, 175 eagle street, brisbane, queensland, 4000",metals and mining,www.newhopegroup.com.au,4,61 7 34180500,1
teradata corp,united states of america,"7,200","17095 via del campo, san diego, california, 92127",technology and communications,www.teradata.com,3,1 937 2424800,1
engro corp ltd,pakistan,"2,766","7th & 8th floors, the harbor front bldg, hc   3,block-4, marine drive, clifton, karachi, 75600",chemicals,www.engro.com,678,92 21 35297501,1
vifor pharma management ltd,switzerland,"2,300","rechenstrasse 37, st. gallen, 9014",pharmaceuticals and healthcare,www.viforpharma.com,,41588528111,1
deutsche pfandbriefbank ag,germany,777,"parkring 28, garching bei muenchen, 85748",financial services,www.pfandbriefbank.com,1,49 89 28800,1
mcafee corp,united states of america,"2,262","6220 america center drive, san jose, california, 95002",technology and communications,www.mcafee.com,,866 622 3911,1
sei investments co,united states of america,"4,371","1 freedom valley dr, oaks, pennsylvania, 19456-9989",financial services,www.seic.com,8,1 610 6761000,1
elringklinger ag,germany,"9,492","max-eyth-strasse 2, dettingen an der erms, 72581",automotive,www.elringklinger.de,545,49 7123 7240,1
national aluminium co ltd,india,"5,525","nalco bhavan, p/1, nayapalli, bhubaneshwar, 751013",metals and mining,www.nalcoindia.com,1,91 674 2301988,1
kongsberg maritime as,norway,"6,815","kirkegardsveien 45, kongsberg, 3616",aerospace and defense,www.kongsberg.com,,47 32 288200,1
tsubakimoto chain co,japan,"8,566","nakanoshima mitsui building 6f, 3-3-3, nakanoshima, kita-ku, osaka-shi, 530-0005",industrial goods and machinery,www.tsubakimoto.jp,906,81 6 64410011,1
ogk-2,russia,"8,437","peterburgskoye shosse, d. 66, korpus 1, lit. a., saint petersburg, 196140",power,ogk2.ru,936,7 812 6461300,1
edenred sa,france,"9,161","166-180 boulevard gabriel peri, issy-les-moulineaux, 92130",business and consumer services,www.edenred.com,13,33 1 74317500,1
nice ltd,israel,"7,102","nice headquarters, 13 zarhin street, nice 1, 2, 3, p.o. box 690, ra'anana, 4310602",technology and communications,www.nice.com,13,972 9 7753777,1
teledyne flir llc,united states of america,"3,000","27700 south west parkway avenue, wilsonville, oregon, 97070",aerospace and defense,www.flir.com,,1 877 7733547,1
redfin corp,united states of america,"6,485","1099 stewart street, suite 600, seattle, washington, 98101",construction,www.redfin.com,625,1 206 5768610,1
nichias corp,japan,"6,402","1-6-1, hatchobori, chuo-ku, tokyo, 104-8555",industrial goods and machinery,www.nichias.co.jp,1,81 3 44131111,1
stroer se & co kgaa,germany,"9,897","stroeer allee 1, koeln, 50999",business and consumer services,www.stroeer.com,3,49 2236 9645246,1
wh smith plc,united kingdom,"11,235","greenbridge road, swindon, sn33rx",retailing,www.whsmithplc.co.uk,2,44 1793 616161,1
hite jinro co ltd,south korea,"3,318","hite jinro bldg., 714, yeongdong-daero, gangnam-gu, seoul, 06075",consumer packaged goods,english.hitejinro.com,1,82 2 32190114,1
sotetsu holdings inc,japan,"5,039","2-9-14, kita-saiwai, nishi-ku, yokohama-shi, kanagawa, 220-0004",transport and logistics,www.sotetsu.co.jp,1,81 45 3192111,1
mbank sa,poland,"6,999","ul. prosta 18, warszawa, 00-850",financial services,www.mbank.pl,3,48 42 6782178,1
torrent power ltd,india,"7,603","samanvay, 600, tapovan, ambavadi, ahmedabad, 380015",power,www.torrentpower.com/index.php/site/indexs,2,91 79 26628000,1
diagnosticos da america sa,brazil,"18,142","avenida jurua, 434, barueri, 06.455-010",medical equipment,www.dasa3.com.br,1,55 11 26303000,1
mace group ltd,united kingdom,"6,526","mace, 155 moorgate, london, greater london, ec2m6xb",construction,www.macegroup.com,,44 20 35223000,1
ptc inc,united states of america,"6,709","121 seaport boulevard, boston, massachusetts, 02210",technology and communications,www.ptc.com,14,1 781 3705000,1
air new zealand ltd,new zealand,"8,863","185 fanshawe street, auckland, 1010",transport and logistics,www.airnewzealand.co.nz,1,64 9 3573000,1
home product center public company ltd,thailand,"10,601","31 prachachuen nonthaburi road, bangkhen, muangnonthaburi, nonthaburi city, 11000",retailing,www.homepro.co.th,5,66 28 321000,1
china coal xinji energy co ltd,china,"15,666","xinji energy office park, minhui street, shannan new area, huainan, anhui, 232001",metals and mining,xinji.chinacoal.com,1,86 554 8661819,1
bok financial corp,united states of america,"4,763","1 williams ctr, tulsa, oklahoma, 74172",financial services,www.bokfinancial.com,6,1 609 2750500,1
hilltop holdings inc,united states of america,"4,900","6565 hillcrest ave., dallas, texas, 75205",financial services,www.hilltop-holdings.com,1,1 214 8552177,1
valio ltd,finland,"25,000","meijeritie 6, helsinki, north karelia, 00370",consumer packaged goods,www.valio.com,,358 10 3812185,1
kronos worldwide inc,united states of america,"2,248","5430 lbj freeway, suite 1700, dallas, texas, 75240",chemicals,kronostio2.com/en,1,1 972 2331700,1
uol group ltd,singapore,"1,500","101 thomson road,  33-00 united square, singapore, 307591",construction,www.uol.com.sg,4,65 6 2550233,1
shandong airlines co ltd,china,"11,783","shandong airlines mansion, no.5746 second ring east road, ji'nan, 250014",transport and logistics,www.sda.cn,194,86 531 82085586,1
university college london hospitals nhs foundation trust,united kingdom,"11,945","2nd floor central, 250 euston road, london, greater london, nw1 2pg",pharmaceuticals and healthcare,www.uclh.nhs.uk,,,1
becle sab de cv,mexico,"9,759","guillermo gonzalez camarena no. 800-4, santa fe, alvaro obregon, 01210",consumer packaged goods,www.cuervo.com.mx,8,52 55 52587000,1
costar group inc,united states of america,"4,742","1331 l st nw, washington, washingtond.c., 20005-4293",business and consumer services,www.costargroup.com,31,1 202 3466500,1
pt bank tabungan negara persero tbk,indonesia,"10,560","menara bank btn, jl. gajah mada no. 1, jakarta pusat, 10130",financial services,www.btn.co.id,1,62 21 6336789,1
oi sa,brazil,"11,288","rua do lavradio, 71,2 andar, centro, rio de janeiro, 20.230-070",technology and communications,www.oi.com.br,149,55 21 31312918,1
jack henry & associates inc,united states of america,"6,847","663 hwy 60, po box 807, monett, missouri, 65708-0807",technology and communications,www.jackhenry.com,13,1 417 2356652,1
black hills corp,united states of america,"2,884","625 9th street, po box 1400, rapid city, south dakota, 57709",energy and utilities,www.blackhillscorp.com,4,1 605 7212343,1
hanssem co ltd,south korea,"2,553","144, beonnyeong 2-ro, danwon-gu, ansan, 15418",consumer packaged goods,www.hanssem.com,973,82 2 69083114,2
pt mayora indah tbk,indonesia,"9,855","jl.tomang raya no. 21-23, jakarta, 11440",consumer packaged goods,mayoraindah.co.id,3,62 21 5655311,2
vitro sab de cv,mexico,"14,765","ave. ricardo margain 400, colonia valle del campestre, san pedro garza garcia, 64410",construction,www.vitro.com,530,52 81 88631600,2
wincanton plc,united kingdom,"20,300","methuen park, chippenham, sn140wt",transport and logistics,www.wincanton.co.uk,465,44 1249 710000,2
lojas renner sa,brazil,"25,474","av. joaquim porto villanova, 401,b jardim do salso, porto alegre, rio grande do norte, 91.410-400",retailing,www.lojasrenner.com.br,3,55 51 21217045,2
ansell limited,australia,"14,158","l 3 678 victoria street, richmond, 3121",medical equipment,www.ansell.com,2,61 3 92707270,2
first citizens bancshares inc,united states of america,"6,578","4300 six forks rd, raleigh, north carolina, 27609-5718",financial services,www.firstcitizens.com/about/who-we-are/profile,12,1 919 7167000,2
city developments ltd,singapore,408,"9 raffles place,  12-01 republic plaza, singapore, 048619",construction,cdl.com.sg,5,65 6 8778228,2
cosco shipping energy transportation co ltd,china,"7,821","no. 670, east daming road, hongkou district, shanghai, 200080",transport and logistics,energy.coscoshipping.com,8,86 21 65967678,2
jiangsu changshu rural commercial bank co ltd,china,"6,849","no. 58 new century avenue, changshu city, suzhou, jiangsu, 215500",financial services,www.csrcbank.com,3,86 512 52909021,2
solaredge technologies inc,israel,"3,964","1 hamada st., pob 12001, herzliya, 4672505",alternative energy,www.solaredge.com,17,972 9 9576620,2
homeserve plc,united kingdom,"8,184","cable drive, walsall, ws27bn",business and consumer services,www.homeserveplc.com,,44 1922 426262,2
icade sa,france,"1,185","immeuble open, 27 rue camille desmoulins, cs 10166, issy-les-moulineaux, 92445",construction,www.icade.fr,3,33 1 41577000,2
wizz air holdings plc,switzerland,"4,709","world trade center 1, geneva international airport, geneve, 1218",transport and logistics,corporate.wizzair.com,3,41 22 5559858,2
rain industries ltd,india,"2,400","rain center, 34, srinagar colony, hyderabad, 500073",chemicals,www.rain-industries.com,740,91 40 40401234,2
installed building products inc,united states of america,"9,500","495 s high st ste 50, columbus, ohio, 43215-5689",construction,installedbuildingproducts.com,3,1 614 2213399,2
berjaya corporation berhad,malaysia,"14,000","level 12  east wing , berjaya times square, no. 1 jalan imbi, kuala lumpur, 55100",leisure and arts,www.berjaya.com,461,60 3 21491999,2
the bombay burmah trading corp ltd,india,"3,087","9, wallace street, fort, mumbai, 400001",agriculture and forestry,bbtcl.com,782,91 22 22197101,2
beijer ref ab,sweden,"4,550","stortorget 8, malmo, 21134",construction,beijerref.com,5,46 40 358900,2
wangfujing group co ltd,china,"16,138","no.253 wangfujing avenue, beijing, 100006",retailing,www.wfj.com.cn,5,86 10 65125960,2
h world group ltd,china,"24,384","no. 1299 fenghua road, jiading district, shanghai, 00000",leisure and arts,ir.hworld.com,15,86 21 61952011,2
turquoise hill resources ltd,canada,"3,478","suite 3680 1 place ville-marie, montreal, quebec, h3b3p2",metals and mining,www.turquoisehill.com,6,1 514 8481567,2
kerry properties ltd,hong kong,"7,400","25/f, kerry centre, 683 king's road, hong kong",construction,www.kerryprops.com,3,852  29672200,2
itron inc,united states of america,"5,635","2111 n molter rd, liberty lake, washington, 99019",clean technology,www.itron.com,2,1 509 9249900,2
harbin pharmaceutical group co ltd,china,"10,206","no. 7 qunli avenue, daoli district, haerbin, heilongjiang, 150070",pharmaceuticals and healthcare,www.hayao.com,1,86 451 51870077,2
fielmann ag,germany,"22,640","weidestrasse 118a, hamburg, 22083",consumer packaged goods,www.fielmann.de,3,49 40 270760,2
grupo kuo sab de cv,mexico,"24,739","paseo de los tamarindos 400-b, piso 31, bosques de las lomas, mexico, d.f., 05120",conglomerate,www.kuo.com.mx,1,52 55 52618000,2
embracer group ab,sweden,"13,877","alvgatan 1, karlstad, 65225",technology and communications,embracer.com,5,46 554 854763,2
graco inc,united states of america,"3,800","88 11th ave ne, minneapolis, minnesota, 55413-1829",industrial goods and machinery,www.graco.com/us/en.html,11,1 612 6236000,2
apollo hospitals enterprise ltd,india,"71,113","ali towers, iii floor, no.55, greams road, chennai, 600006",pharmaceuticals and healthcare,www.apollohospitals.com,7,91 44 28290956,2
cooley llp,united states of america,"2,900","3175 hanover street, palo alto, california, 94304-1130",business and consumer services,www.cooley.com,,1 650 8435000,2
south jersey industries inc,united states of america,"1,169","1 south jersey plaza, route 54, folsom, new jersey, 08037",energy and utilities,www.sjindustries.com,4,1 609 5619000,2
pc partner group ltd,hong kong,"2,572","19/f.,shatin galleria, 18-24 shan mei street, fo tan, shatin, new territories, hong kong",technology and communications,www.pcpartner.com,226,852  27998011,2
echostar corp,united states of america,"2,500","100 inverness ter e, englewood, colorado, 80112-5308",technology and communications,www.echostar.com,1,1 303 7231277,2
bluestar adisseo co,china,"2,455","no. 9, beitucheng west road, chaoyang district, beijing, 100029",chemicals,www.bluestar-adisseo.com,3,86 10 61958799,2
nestle india ltd,india,"7,910","nestle house, jacaranda marg m block, dlf city phase ii, national highway 8, gurgaon, haryana, 122002",consumer packaged goods,www.nestle.in,23,91 124 2389300,2
molnlycke health care ab,sweden,"8,000","gamlestadsvaegen 3c, gothenburg, vastra gotaland, 41502",medical equipment,www.molnlycke.com,,46 31 7223000,2
people's united financial inc,united states of america,"5,193","850 main st, bridgeport, connecticut, 06604-4917",financial services,www.peoples.com,,1 203 3384114,2
audax renovables sa,spain,806,"c/ del temple, 25, badalona, 08911",alternative energy,www.audaxrenovables.com,621,34 932 405306,2
hangzhou first applied material co ltd,china,"2,997","no. 407, xishu street, lin'an city, hangzhou, zhejiang, 311300",alternative energy,www.firstpvm.com,14,86 571 61076968,2
banco do estado do rio grande do sul sa,brazil,"8,789","rua capitao montanha, 177, centro, porto alegre, 90.018-900",financial services,www.banrisul.com.br,805,55 51 32151515,2
avic jonhon optronic technology co ltd,china,"14,537","no. 10, zhoushan road, high-tech development zone, luoyang, henan, 471003",industrial goods and machinery,www.jonhon.cn,13,86 379 63011079,2
kalpataru power transmission ltd,india,"3,072","101, kalpataru synergy, 7th floor, opp, grand hyatt hotel, vakola, santacruz  e , mumbai, 400055",power,www.kalpatarupower.com,947,91 22 30645000,2
invitation homes inc,united states of america,"1,240","1717 main st ste 2000, dallas, texas, 75201-4657",construction,www.invitationhomes.com,18,1 972 4213600,2
national mobile telecommunications co ksc,kuwait,441,"murgab alsoor st. ooredoo tower,  safat, po box 613, 13007",technology and communications,10.wataniya.com,1,965 2 2435500,2
unifirst corp,united states of america,"14,000","68 jonspin road, wilmington, massachusetts, 01887",consumer packaged goods,www.unifirst.com,3,1 978 6588888,2
sino land co ltd,hong kong,"7,000","11th-12th floor, tsim sha tsui centre, salisbury road, kowloon, hong kong",construction,www.sino.com/tc/investor-relations/,10,852 2721 8388,2
cdk global inc,united states of america,"6,500","1950 hassell rd, hoffman estates, illinois, 60169",technology and communications,www.cdkglobal.com,,1 847 4854020,2
the providence service corporation,united states of america,,"6900 layton avenue, 12th floor, denver, colorado, 80237",business and consumer services,modivcare.com,1,1 303 7287030,2
horiba ltd,japan,"8,205","2, miyanohigashi-cho, kisshoin, minami-ku, kyoto-shi, 601-8510",automotive,www.horiba.com,1,81 75 3138121,2
japan aviation electronics industry ltd,japan,"9,427","12f, shibuya solasta, 1-21-1, dogenzaka, shibuya-ku, tokyo, 150-0043",technology and communications,www.jae.com,1,81 3 37802711,2
genesis energy ltd,new zealand,"1,149","the genesis energy building, 660 great south road, greenlane, auckland, 1010",power,www.genesisenergy.co.nz,1,64 9 5802094,2
taiwan glass industry corp,taiwan,"15,946","no.261 sec. 3, nanjing east road, songshan district, taipei, 105",paper and packaging,www.taiwanglass.com,2,886 2 27130333,2
tsim sha tsui properties ltd,hong kong,"5,800","12th floor, tsim sha tsui centre, salisbury road, tsim sha tsui, hong kong, 999077",construction,www.sino.com/en/investor-relations/tsim-sha-tsui-properties-limited,5,852  27218388,2
leon's furniture ltd,canada,"8,434","45 gordon mackay rd, north york, ontario, m9n3x3",retailing,www.leons.ca,882,1 416 2437880,2
chesnara plc,united kingdom,322,"4 west strand, preston, pr18uy",financial services,www.chesnara.co.uk,537,44 1772 972050,2
amcon distributing co,united states of america,749,"post office box 641940  68164-7940 , 7405 irvington road, omaha, nebraska, 68122",wholesale,www.amcon.com,109,1 402 3313727,2
minsur sa,peru,527,"oficina 501 - a, san borja",metals and mining,www.minsur.com,924,51 1 2158330,2
melco international development ltd,hong kong,"17,270","38th floor, the centrium, 60 wyndham street, central, hong kong",leisure and arts,www.melco-group.com,2,852  31513777,2
glory ltd,japan,"10,677","1-3-1, shimoteno, himeji-shi, hyogo, 670-8567",technology and communications,www.glory.co.jp,1,81 79 2973131,2
kennametal inc,united states of america,"8,732","1600 technology way, p o box 231, latrobe, pennsylvania, 15650",industrial goods and machinery,www.kennametal.com/us/en/home.html,2,1 724 5395000,2
bgc partners inc,united states of america,"3,920","499 park ave, new york, 10022",financial services,www.bgcpartners.com,1,1 212 6102200,2
internet initiative japan inc,japan,"4,147","iidabashi grand bloom, 2-10-2, chiyoda-ku, tokyo, 102-0071",technology and communications,www.iij.ad.jp,3,81 3 52056500,2
melco resorts & entertainment limited,hong kong,"17,878","36/f the centrium, 60 wyndham street, central, hong kong, 00000",leisure and arts,www.melco-resorts.com,5,852  25983600,2
nabors industries ltd,bermuda,"10,000","crown house, 4 par-la-ville road, hamilton, hm08",energy and utilities,www.nabors.com,1,1 441 2921510,2
ncsoft corp,south korea,"2,300","509, teheran-ro, gangnam-gu, seoul, 06169",technology and communications,kr.ncsoft.com,8,82 2 21863300,2
nine entertainment co holdings ltd,australia,"3,350","level 9, 1 denison street, north sydney, new south wales, 2060",media,www.nineforbrands.com.au/investors,2,61 2 91566999,2
murray & roberts holdings ltd,south africa,"8,394","bedforview, johannesburg, gauteng, 2007",construction,www.murrob.com,67,27 11 4566200,2
samsonite international sa,luxembourg,"9,500","13-15 avenue de la liberte, luxembourg, 1931",consumer packaged goods,www.samsonite.com,4,,2
localiza rent a car sa,brazil,"12,610","avenida bernardo de vasconcelos, 377, cachoeirinha, belo horizonte, 31.150-000",business and consumer services,www.localizahertz.com,11,55 31 32479460,2
s-1 corp,south korea,"6,239","25, sejong-daero 7-gil, jung-gu, seoul, 04511",technology and communications,www.s1.co.kr,1,82 2 15883112,2
deluxe corp,united states of america,"6,313","801 s. marquette ave., minneapolis, minnesota, 55402",media,www.deluxe.com,834,1 651 4837111,2
adaresources & energy inc,united states of america,710,"17 s briar hollow ln, houston, texas, 77027-3155",energy and utilities,www.adamsresources.com,119,1 713 8813600,2
acco brands corp,united states of america,"6,000","four corporate drive, lake zurich, illinois, 60047",consumer packaged goods,www.accobrands.com,564,1 847 5419500,2
nokian tyres plc,finland,"4,927","pirkkalaistie 7, pl 20, nokia, 37101",automotive,www.nokianrenkaat.fi,1,358 10 4017000,2
titan cement international sa,belgium,"5,393","rue de la loi 23, 7th floor, box 4, bruxelles, 1040",construction,www.titan-cement.com,1,32 2 7268058,2
longchen paper & packaging co ltd,taiwan,"4,520","no.1-1, kuang hsin lane, kuang hsin li, erlin, 526",paper and packaging,www.longchenpaper.com,768,886 2 55811777,2
ecovacs robotics co ltd,china,"7,854","no.18 youxiang road, wuzhong district, suzhou, jiangsu, 215104",technology and communications,www.ecovacs.cn,7,86 512 65875866,2
