name,headquarters,number_of_employees,address,industry,website,market_cap,telephone,revenue
groupe seb sa,france,"32,373","112, chemin du moulin-carron, ecully, 69130",consumer packaged goods,www.groupeseb.com,5,33 4 72181818,9
carlsberg as,denmark,"39,375","1 j.c. jacobsens gade, copenhagen, 1799",consumer packaged goods,www.carlsberggroup.com,20,45  33210112,9
gestamp automocion sa,spain,"39,908","poligono industrial de lebario s/n, abadino, vizcaya, 48220",automotive,www.gestamp.com/es,2,34 944 507000,9
caesars entertainment inc,united states of america,"49,000","100 west liberty street, 12th floor, reno, nevada, 89501",leisure and arts,www.caesars.com,10,1 775 3280100,9
malayan banking berhad,malaysia,"42,000","14th floor, menara maybank, 100, jalan tun perak, kuala lumpur, 50050",financial services,www.maybank.com,24,60 3 20708833,9
darden restaurants inc,united states of america,"178,956","1000 darden center dr, orlando, florida, 32837-4032",leisure and arts,www.darden.com,17,1 407 2454000,9
cincinnati financial corp,united states of america,"5,166","6200 s gilmore rd, fairfield, ohio, 45014",financial services,www.cinfin.com,16,1 513 8702000,9
shanghai tunnel engineering co ltd,china,"15,765","no. 1099, wanping south road, xuhui district, shanghai, 200032",construction,www.stec.net,2,86 21 65419590,9
electric power development co ltd,japan,"7,146","6-15-1, ginza, chuo-ku, tokyo, 104-8165",power,www.jpower.co.jp,2,81 3 35462211,9
ryder system inc,united states of america,"42,800","11690 nw 105th st, miami, florida, 33178",transport and logistics,ryder.com,4,1 305 5003726,9
tcl electronics holdings ltd,china,"26,965","9 floor, tcl multimedia building, tcl in, no. 1001 zhongshan park road, tcl international e city, nanshan dist., shenzhen, guangdong, 518067",consumer packaged goods,electronics.tcl.com/en/global/home.php,1,86 852 24377300,9
acciona sa,spain,"44,476","vda. de europa, 18. parque empresarial la moraleja, alcobendas, madrid, 28108",industrial goods and machinery,www.acciona.com,11,34 916 632850,9
dentsu group inc,japan,"64,832","dentsu honsha bldg., 1-8-1, higashi-shimbashi, minato-ku, tokyo, 105-7050",media,www.group.dentsu.com,8,81 3 62176600,9
china national nuclear power co ltd,china,"15,756","no. 1 south 4th lane, sanlihe, xicheng district, beijing, 100097",nuclear energy,www.cnnp.com.cn,16,86 10 81920188,9
siberian coal energy co,russia,"73,000","53/7, dubininskaya street, moscow, 115054",metals and mining,www.suek.ru,,7 495 7952538,9
owens & minor inc,united states of america,"6,900","9120 lockwood blvd, mechanicsville, virginia, 23116",medical equipment,www.owens-minor.com,1,1 804 7237000,9
mgm resorts international,united states of america,"42,000","3600 las vegas blvd s, nevada, 89109",leisure and arts,www.mgmresorts.com,14,1 702 6937120,9
public service enterprise group inc,united states of america,"12,684","corporate accounting services, 80 park plaza, 9th floor, newark, new jersey, 07102-4194",power,corporate.pseg.com,30,1 973 4307000,9
united rentals inc,united states of america,"20,400","suite 700, 100 first stamford place, connecticut, 06902",business and consumer services,www.unitedrentals.com,26,,9
xinjiang zhongtai chemical co ltd,china,"20,678","no.39 yangcheng lake road, urumqi economic and tchnlgcl dvlpmnt zn, wulumuqi, xinjiang, 830054",chemicals,www.zthx.com,2,86 991 8751690,9
formosa plastics corp,taiwan,"6,784","no.100, shuiguan road, zhuhou li, renwu district, kaohsiung, 814",chemicals,www.fpc.com.tw,18,886 2 27122211,9
china aoyuan group ltd,china,"22,889","aoyuan tower, no. 48, wanhui yi road, panyu district, guangzhou, guangdong, 510620",construction,www.aoyuan.com.cn,446,86 20 38686666,9
yunnan yuntianhua co ltd,china,"11,379","no. 1417, dianchi road, kunming, yunnan, 650228",chemicals,www.yyth.com.cn,5,86 871 64327127,9
asbury automotive group inc,united states of america,"14,200","suite 300, 2905 premiere parkway nw, duluth, georgia, 30097",automotive,www.asburyauto.com,4,1 770 4188200,9
doosan enerbility co ltd,south korea,"7,779","22, doosanvolvo-ro, seongsan-gu, changwon, 51711",industrial goods and machinery,www.doosanenerbility.com,8,82 55 2786114,9
tongwei group co ltd,china,"32,224","no.11 south four section, 2nd ring road, chengdu, sichuan, 610041",agriculture and forestry,www.tongwei.com.cn,27,86 28 86168555,9
yum china holdings inc,china,"147,000","6/f-16/f, yum china building, 20 tian yao qiao road, shanghai",leisure and arts,www.yumchina.com,23,1 30 26587581,9
baloise holding ltd,switzerland,"7,693","aeschengraben 21, basel, 4001",financial services,www.baloise.com,7,41 61 2858585,9
emcor group inc,united states of america,"34,000","6th floor, 301 merritt seven corporate pk, norwalk, connecticut, 06851",construction,www.emcorgroup.com,7,1 203 8497800,9
ramsay health care ltd,australia,"86,000","level 7, tower b, 7 westbourne street, st leonards, victoria, 2065",pharmaceuticals and healthcare,www.ramsayhealth.com,10,61 2 94333444,9
rbc wealth management,canada,"19,486","suite 600, royal bank plaza, south tower, 200 bay street, toronto, ontario, m5j2j5",financial services,www.rbcwealthmanagement.com,,1 888 2125533,9
china state construction international holdings ltd,hong kong,"14,241","28/f., china overseas building, 139 hennessy road, wanchai, hong kong",construction,www.csci.com.hk,5,852  28237888,9
sea ltd,singapore,"67,300","1 fusionopolis place,  17-10 galaxis, singapore, 138522",technology and communications,www.sea.com,28,65 6 2708100,10
agl energy ltd,australia,"3,897","locked bag 14120 mcmc, melbourne, victoria, 8001",power,www.agl.com.au,3,61 2 99212999,9
eversource energy,united states of america,"9,227","300 cadwell dr, springfield, massachusetts, 01104-1742",power,www.eversource.com,28,1 860 6655000,9
bid corp ltd,south africa,"24,978","2nd floor, north wing, 90 rivonia road, sandton, johannesburg, 2196",wholesale,www.bidcorpgroup.com,7,27 10 5922150,10
balfour beatty plc,united kingdom,"24,500","canary wharf, 5 churchill place, london, e145hu",construction,www.balfourbeatty.com,2,44 20 72166800,9
sino-ocean group holding ltd,china,"14,222","31-33 flr,blck a,ocean intrntnl ctr, 56 east sihuan middle road,56 dongsihuan, chaoyang district, beijing, 100025",construction,www.sinooceangroup.com,1,86 10 59293377,10
ds smith plc,united kingdom,"29,856","7th fl, regents place, 350 euston road, london, nw13ax",paper and packaging,www.dssmith.com,6,44 20 77561800,10
sun hung kai properties ltd,hong kong,"40,500","45th floor, sun hung kai centre, 30 harbour road, hong kong",construction,www.shkp.com,40,852  28278111,10
sandvik ab,sweden,"39,571","kungsbron 1, section 6, plan g, stockholm, 11122",industrial goods and machinery,www.home.sandvik/en,26,46 8 4561100,10
minebeamitsumi inc,japan,"81,659","4106-73, miyota miyota-machi, kitasaku-gun, nagano, 389-0293",industrial goods and machinery,www.minebeamitsumi.com,7,81 26 7322200,10
international consolidated airlines group sa,united kingdom,"56,658","waterside  haa2 , po box 365, harmondsworth, ub70gb",transport and logistics,www.iairgroup.com/es,9,,10
nine dragons paper holdings ltd,hong kong,"20,098","room 3129, 31/f, sun hung kai centre, 30 harbour road wanchai, hong kong",paper and packaging,www.ndpaper.com,4,852  39293800,10
relx group plc,united kingdom,"33,500","grand buildings, 1-3 strand, london, wc2n5jr",business and consumer services,www.relx.com,56,44 20 71665660,10
mplx lp,united states of america,"5,836","200 e hardin st, findlay, ohio, 45840",energy and utilities,www.mplx.com,34,1 419 4212159,10
pt telekomunikasi indonesia tbk,indonesia,"20,897","graha merah putih, jl. japati no. 1, bandung, 40133",technology and communications,www.telkom.co.id,25,62 21 5215109,10
china resources gas group ltd,hong kong,"52,780","room 1901-02, 19f, china resources bldg, 26 harbour road, wanchai, hong kong",energy and utilities,www.crcgas.com,9,852  25938200,10
seiko epson corp,japan,"77,642","3-3-5, owa, suwa-shi, nagano, 392-8502",technology and communications,www.epson.jp,6,81 26 6523131,10
yapi ve kredi bankasi as,turkey,"16,295","yapi ve kredi bankasi a.s., istanbul, 34330",financial services,www.yapikredi.com.tr,4,90 212 3397000,10
wens foodstuff group co ltd,china,"43,965","no.9 east dike north road, xincheng town, xinxing county, yunfu, guangdong, 527400",agriculture and forestry,www.wens.com.cn,20,86 766 2292926,10
altice usa inc,united states of america,"9,000","1 court square west, long island city, new york, 11101",technology and communications,www.alticeusa.com,2,1 516 8032300,10
ugi corp,united states of america,"5,800","460 n gulph rd, p o box 858, king of prussia, pennsylvania, 19406",energy and utilities,www.ugicorp.com,8,1 610 3371000,10
the chugoku electric power co inc,japan,"12,949","4-33, ko-machi, naka-ku, hiroshima-shi, 730-8701",power,www.energia.co.jp,2,81 82 2410211,10
sika ag,switzerland,"27,415","zugerstrasse 50, baar, 6340",chemicals,www.sika.com,43,41 58 4366800,10
pt bank mandiri persero tbk,indonesia,"37,605","jenderal gatot subroto street kav. 36-38, jakarta selatan, 12190",financial services,www.bankmandiri.co.id,29,62 21 5265045,10
golden agri-resources ltd,singapore,"88,467","06-00 golden agri plaza, 108 pasir panjang road, singapore, 118535",agriculture and forestry,www.goldenagri.com.sg,2,65 6 5900800,10
assurant inc,united states of america,"15,600","55 broadway, suite 2901, new york, 10006",financial services,www.assurant.com,6,1 212 8597000,10
weyerhaeuser co,united states of america,"9,214","220 occidental avenue south, seattle, washington, 98104",construction,www.weyerhaeuser.com,23,1 206 5393000,10
saras spa,italy,"1,572","s.s. sulcitana n.195 - km.19, sarroch, 09018",energy and utilities,www.saras.it/it,1,39 070 90911,10
hydro-quebec,canada,"21,168","edifice jean-lesage, 75, boulevard rene-levesque ouest, 20e etage, montreal, quebec, h2z1a4",alternative energy,www.hydroquebec.com,,1 514 3857252,10
turkiye vakiflar bankasi turk anonim ortaklig,turkey,"16,888","genel mudurlugu saray mahallesi dr. adnan buyukdeniz caddesi no: 7/a-b umraniye, istanbul, istanbul-i  thrace , 34415",financial services,www.vakifbank.com.tr,3,90 216 7241000,10
the interpublic group of companies inc,united states of america,"55,600","24th floor, 909 third avenue, new york, 10022",media,www.interpublic.com,13,1 212 7041200,10
ajinomoto co inc,japan,"34,198","1-15-1, kyobashi, chuo-ku, tokyo, 104-8315",consumer packaged goods,www.ajinomoto.co.jp,17,81 3 52508111,10
gazprombank,russia,,"16 nametkina street, building 1, moscow city, 117420",financial services,www.gazprombank.ru,,7 495 9137474,10
china faw group co ltd,china,"120,000","288 tianfu road, jingyue development zone, changchun city, jilin, 130011",automotive,www.faw.com,,86 431 81121212,10
sime darby bhd,malaysia,"22,862","19th floor, wisma sime darby, jalan raja laut, petaling  jaya, 47301",automotive,www.simedarby.com,3,60 3 76232000,10
wuliangye yibin co ltd,china,"25,803","no. 150, minjiang west road, cuiping district, yibin, sichuan, 644007",consumer packaged goods,www.wuliangye.com.cn,118,86 831 3567000,10
cgi group inc,canada,"84,000","15th floor, 1350 rene levesque boulevard west, montreal, quebec, h3g1t4",technology and communications,www.cgi.com/en,18,1 514 8413200,10
pzu sa,poland,"39,751","al. jana pawla ii 24, warszawa, 00-133",financial services,www.pzu.pl,7,48 22 5822000,10
molson coors beverage co,united states of america,"16,300","nh353, p.o. box 4030, golden, colorado, 80401",consumer packaged goods,www.molsoncoors.com,10,1 303 2796565,10
toll brothers inc,united states of america,"5,100","1140 virginia drive, fort washington, pennsylvania, 19034",construction,www.tollbrothers.com,6,1 215 9388000,10
telia co ab,sweden,"19,150","stjarntorget 1, solna, 16994",technology and communications,www.teliacompany.com,11,46 8 50455000,10
huishang bank corp ltd,china,"10,820","huiyin mansion, no. 1699 yungu road, hefei, anhui, 230092",financial services,www.hsbank.com.cn,4,86 551 62667729,10
china cinda asset management co ltd,china,"13,648","no. 1 building, 9 naoshikou street, xicheng district, beijing, 100031",financial services,www.cinda.com.cn,13,86 10 63080000,10
sekisui chemical co ltd,japan,"26,419","dojima kanden bldg., 2-4-4, nishitemma, kita-ku, osaka-shi, 530-8565",chemicals,www.sekisui.co.jp,6,81 6 63654110,10
liberty global plc,united kingdom,"11,200","161 hammersmith road, w68bs",technology and communications,www.libertyglobal.com,9,44 20 84836300,10
power finance corp ltd,india,501,"urjanidhi', 1, barakhamba lane, connaught place, new delhi, 110001",financial services,www.pfcindia.com,4,91 11 23456740,10
beijing enterprises holdings ltd,hong kong,"35,000","66th floor, central plaza, 18 harbour road, wanchai, hong kong",energy and utilities,www.behl.com.hk,4,852  29152898,10
cez as,czech republic,"28,043","duhova 2/1444, prague, karlovy vary , 14053",power,www.cez.cz,19,420 2 11041111,10
china eastern airlines corp ltd,china,"80,321","no. 36, hongxiang 3rd road, minhang district, shanghai, 201100",transport and logistics,www.ceair.com,15,86 21 22330932,10
zoomlion heavy industry science and technology co ltd,china,"26,036","no.361 yinpen south road, changsha, hunan, 410013",industrial goods and machinery,en.zoomlion.com,6,86 731 85650157,10
news corp,united states of america,"25,500","1211 avenue of the americas, new york, 10036-8701",media,newscorp.com,10,1 212 4163400,10
ebay inc,united states of america,"10,800","2025 hamilton avenue, san jose, california, 95125",retailing,www.ebayinc.com,25,1 408 3767108,10
ihi corp,japan,"28,801","toyosu ihi bldg., 3-1-1, toyosu, koto-ku, tokyo, 135-8710",industrial goods and machinery,www.ihi.co.jp,4,81 3 62047800,10
insurance australia group ltd,australia,"13,650","darling park, twr two, l 13 201 sussex street, sydney, new south wales, 2000",financial services,www.iag.com.au,8,61 2 92929222,10
nh foods ltd,japan,"16,192","18f, breeze tower, 2-4-9, umeda, kita-ku, osaka-shi, 530-0001",consumer packaged goods,www.nipponham.co.jp,2,81 6 75253026,10
eastman chemical co,united states of america,"14,000","200 south wilcox drive, po box 511, kingsport, tennessee, 37660",chemicals,www.eastman.com,10,1 423 2292000,10
tennessee valley authority,united states of america,"10,192","400 west summit hill dr., knoxville, tennessee, 37902",power,www.tva.com,,,10
china tourism group duty free corp ltd,china,"14,720","8th floor, block a, no. 2, dongzhimen waixiao jie, beijing city, 100027",leisure and arts,www.ctgdutyfree.com.cn,69,86 10 84478866,10
steinhoff international holdings nv,south africa,"90,731","building b2, vineyard office park, cnr adam tas & devon valley road, stellenbosch, 7600",retailing,www.steinhoffinternational.com,128,27 21 8080700,10
reliance jio infocomm ltd,india,,"5th floor, maker chambers iv, 222, nariman point, mumbai, maharashtra, 400021",technology and communications,www.jio.com,,91 2244 770000,10
inchcape plc,united kingdom,"14,500","22a st. james's square, london, sw1y5lp",automotive,www.inchcape.com,4,44 20 75460022,10
west fraser timber co ltd,canada,"11,000","c/o west fraser group, 501-858 beatty st, vancouver, british columbia, v6b1c1",agriculture and forestry,www.westfraser.com,5,1 604 8952745,10
bouygues construction,france,"53,000","1, avenue eugene freyssinet, guyancourt, saint-quentin-en-yvelines, ile-de-france, 78280",construction,www.bouygues-construction.com,,33 1 30603300,10
mirae asset securities co ltd,south korea,"2,989","mirae asset center 1 bldg., 26, eulji-ro 5-gil, jung-gu, seoul, 04539",financial services,securities.miraeasset.com,3,82 2 37741700,10
csl ltd,australia,"30,000","45 poplar road, parkville, melbourne, victoria, 3052",pharmaceuticals and healthcare,www.csl.com,98,61 3 93891911,10
the williacompanies inc,united states of america,"4,783","one williams ctr, tulsa, oklahoma, 74172",energy and utilities,www.williams.com,38,1 918 5732000,10
hermes international sa,france,"18,428","24 rue du faubourg saint honore, paris, 75008",retailing,finance.hermes.com/en,189,33 1 40174920,10
newell brands inc,united states of america,"32,000","6655 peachtree dunwoody road, atlanta, georgia, 30328",consumer packaged goods,www.newellbrands.com,6,1 770 4187000,10
china bohai bank co ltd,china,"12,102","218 haihe east road, hedong district, tianjin, 300012",financial services,www.cbhb.com.cn,3,86 22 58789668,10
emirates nbd bank,united arab emirates,"6,922","bani yas street, deira, p.o. box 777, dubai",financial services,www.emiratesnbd.com/en,22,971 4 2222555,10
delek us holdings inc,united states of america,"3,312","7102 commerce way, brentwood, tennessee, 37027-2896",energy and utilities,www.delekus.com,1,1 615 7213715,10
turkiye garanti bankas anonim sirketi,turkey,"18,569","garanti bbva, istanbul, 34340",financial services,www.garantibbva.com.tr,5,90 212 3181818,10
tc energy corporation,canada,"7,017","450 1 st sw, calgary, alberta, t2p5h1",energy and utilities,www.tcenergy.com,43,1 403 9202000,10
turk hava yollari anonim ortakligi,turkey,"37,546","ataturk havalimani bakirkoy yesilkoy, istanbul, 34149",transport and logistics,www.turkishairlines.com,11,90 212 4636363,10
ally financial inc,united states of america,"10,500","ally detroit center, 500 woodward ave. floor 10, michigan, 48226",financial services,www.ally.com,8,1 866 7104623,10
guangzhou baiyunshan pharmaceutical holdings co ltd,china,"24,771","no. 45 shamian north street, liwan district, guangzhou, guangdong, 510130",pharmaceuticals and healthcare,www.gybys.com.cn,6,86 20 66281217,10
dcp midstream lp,united states of america,,"6900 east layton avenue, suite 900, denver, colorado, 80237",energy and utilities,www.dcpmidstream.com,8,1 303 5953331,10
wipro ltd,india,"259,179","doddakannelli, sarjapur road, bangalore, karnataka, 560035",technology and communications,www.wipro.com,27,91 80 28440011,10
zim integrated shipping services ltd,israel,"4,427","9 andrei sakharov street, p.o. box 15067, haifa, 3190500",transport and logistics,www.zim.com,2,972 4 8652000,10
teck resources ltd,canada,"10,600","550 burrard st suite 3300, vancouver, british columbia, v6c0b3",metals and mining,www.teck.com,21,1 604 6994000,10
grupo financiero banorte sab de cv,mexico,"30,085","av. revolucion 3000, col. primavera, mexico, d.f., 05349",financial services,www.banorte.com,23,52 55 11034000,10
swiss federal railways,switzerland,"33,943","hochschulstrasse 6, berne 65, 3000",transport and logistics,www.sbb.ch,,41 51 2204111,10
sinopec oilfield service corp,china,"69,232","no. 9, jishikou road, chaoyang district, beijing, 100728",energy and utilities,ssc.sinopec.com,4,86 10 59965998,10
quest diagnostics inc,united states of america,"40,000","500 plaza drive, secaucus, new jersey, 07094",medical equipment,www.questdiagnostics.com,16,1 973 5202700,10
wegmans food markets inc,united states of america,"52,000","p.o. box 30844, 1500 brooks avenue, rochester, new york, 14603",retailing,www.wegmans.com,,1 800 9346267,10
clp holdings ltd,hong kong,"8,183","8 laguna verde avenue, hung hom, kowloon, hong kong",power,www.clpgroup.com,18,852  26788111,10
thai oil public co ltd,thailand,587,"555/1 energy complx bldng a, 11th flr, vibhavadi rangsit road, chatuchak, bangkok, 10900",energy and utilities,www.thaioilgroup.com,3,66 27 972999,10
origin energy ltd,australia,"5,000","level 32, tower 1, 100 barangaroo avenue, new south wales, 2000",power,www.originenergy.com.au,8,61 2 83455000,10
amphenol corp,united states of america,"90,000","358 hall ave, wallingford, connecticut, 06492-3574",technology and communications,www.amphenol.com,47,1 203 2658900,10
royal dsm nv,netherlands,"21,760","het overloon 1, heerlen, 6411te",chemicals,www.dsm.com,23,31 45 5782864,10
eternal asia supply chain management ltd,china,"8,034","27f, international culture mansion, no. 3039 shennan middle road, futian district, shenzhen, guangdong, 518114",transport and logistics,www.eascs.com,2,86 755 88393181,10
jsfc sistema,russia,"138,892","ul.mokhovaya, dom 13, stroenie 1, moscow, 125009",technology and communications,sistema.ru,1,7 495 7300599,10
southern copper corp,united states of america,"14,700","7310 north 16th st., suite 135, phoenix, arizona, 85020",metals and mining,southerncoppercorp.com,58,1 602 2641375,10
helleniq energy holdings sa,greece,"3,500","8a chimarras str., maroussi, athina, 15125",energy and utilities,www.helpe.gr,2,30 21 06302000,10
mckesson europe ag,germany,"6,808","stockholmer platz 1, stuttgart, baden-wurttemberg, 70173",retailing,www.mckesson.eu,4,49 711 500100,10
booking holdings inc,united states of america,"20,300","800 connecticut ave, norwalk, 06854-1631",leisure and arts,www.bookingholdings.com,89,1 203 2998000,11
the boston consulting group,united states of america,"25,000","200 pier 4 boulevard, boston, massachusetts, 02210",business and consumer services,www.bcg.com,,1 617 9731200,11
tpv technology co ltd,china,"22,734","no. 77 tianyou road, qixia district, nanjing, jiangsu, 210033",technology and communications,www.tpv-tech.com,1,86 755 36358633,10
biogen inc,united states of america,"9,610","225 binney street, cambridge, massachusetts, 02142",pharmaceuticals and healthcare,www.biogen.com,40,1 781 4642000,11
advance auto parts inc,united states of america,"41,000","4200 six forks road, raleigh, north carolina, 27609",automotive,shop.advanceautoparts.com,8,1 540 3624911,11
zhejiang zheneng electric power co ltd,china,"9,423","no.152 tianmushan road, hangzhou, zhejiang, 310007",power,www.zzepc.com.cn,6,86 571 87210223,11
anhui construction engineering group co ltd,china,"17,010","anjian international mansion, no.459 huangshan road, shushan district, hefei, anhui, 230031",construction,www.aceg.com.cn,1,86 551 62865300,11
nxp semiconductors nv,netherlands,"31,000","high tech campus 60, eindhoven, 5656ag",technology and communications,www.nxp.com,44,31 40 2728686,11
inpex corp,japan,"3,189","akasaka biz tower, 5-3-1, akasaka, minato-ku, tokyo, 107-6332",energy and utilities,www.inpex.co.jp,15,81 3 55720200,11
assa abloy ab,sweden,"51,937","klarabergsviadukten 90, stockholm, 11164",construction,www.assaabloy.com,25,46 8 50648500,11
union bank of india,india,"75,201","union bank bhavan, 239, vidhan bhavan marg, nariman point, mumbai, 400021",financial services,www.unionbankofindia.co.in,6,91 22 22892000,11
firstenergy corp,united states of america,"12,395","76 south main street, akron, ohio, 44308-1890",power,www.firstenergycorp.com,24,1 330 7617837,11
national bank of canada,canada,"29,509","600 de la gauchetiere st w 7th floor, montreal, quebec, h3b4l2",financial services,www.nbc.ca,24,1 514 3946751,11
icahn enterprises lp,united states of america,"19,500","16690 collins ave, ph-1, sunny isles beach, florida, 33160",conglomerate,www.ielp.com,17,1 212 7024300,11
agco corporation,united states of america,"23,300","4205 river green pkway, duluth, georgia, 30096",industrial goods and machinery,www.agcocorp.com,10,1 770 8139200,11
the aes corp,united states of america,"8,450","4300 wilson blvd, arlington, virginia, 22203-4167",power,www.aes.com,18,1 703 5221315,11
norfolk southern corp,united states of america,"18,100","650 w peachtree street nw, atlanta, georgia, 30308",transport and logistics,www.nscorp.com,59,1 470 4636807,11
asr nederland nv,netherlands,"4,242","archimedeslaan 10, po box 2072, utrecht, 3584ba",financial services,asrnederland.nl,6,31 30 2579111,11
firstrand ltd,south africa,"48,059","4 merchant place, corner fredman drive & rivonia road, sandton, 2196",financial services,www.firstrand.co.za,21,27 11 2821808,11
ssab ab,sweden,"14,492","klarabergsviadukten 70, d6, box 70, stockholm, 10121",metals and mining,www.ssab.com,6,46 8 4545700,11
mohawk industries inc,united states of america,"43,000","160 s industrial blvd, po box 12069, calhoun, georgia, 30701",construction,mohawkind.com,7,1 678 3555814,11
sumitomo metal mining co ltd,japan,"7,202","shimbashi sumitomo bldg., 5-11-3, shimbashi, minato-ku, tokyo, 105-8716",metals and mining,www.smm.co.jp,11,81 3 34367701,11
sbi life insurance co ltd,india,"18,515","turner morrison building, 2nd floor, 16, bank street, fort, mumbai, 400069",financial services,www.sbilife.co.in,16,91 22 61911000,11
arkema sa,france,"20,200","420 rue d'estienne d'orves, colombes, 92700",chemicals,www.arkema.com,7,33 1 49008080,11
the norinchukin bank,japan,"3,462","2-1, otemachi 1-chome, chiyoda-ku, tokyo, 100-8155",financial services,www.nochubank.or.jp,,81 3 32790111,11
toho holdings co ltd,japan,"7,785","5-2-1, daizawa, setagaya-ku, tokyo, 155-8655",wholesale,www.tohohd.co.jp,1,81 3 34197811,11
delta electronics inc,taiwan,"68,000","no. 186, ruey kuang road, neihu district, taipei, 114501",technology and communications,www.deltaww.com,24,886 2 87972088,11
republic services inc,united states of america,"35,000","18500 n allied way, phoenix, arizona, 85054-6164",clean technology,www.republicservices.com,38,1 480 6272700,11
suntory beverage & food ltd,japan,"23,866","tamachi station tower n, 3-1-1, shibaura, minato-ku, tokyo, 108-8503",consumer packaged goods,www.suntory.co.jp/softdrink,10,81 3 68095950,11
mitsui osk lines ltd,japan,"8,547","shosen mitsui bldg., 2-1-1, toranomon, minato-ku, tokyo, 105-8688",transport and logistics,www.mol.co.jp,9,81 3 35877026,11
raymond james financial inc,united states of america,"17,000","880 carillon pkwy, st petersburg, florida, 33716",financial services,www.raymondjames.com,24,1 727 5671000,11
vivendi sa,france,"35,911","42 avenue de friedland, paris cedex 08, ile-de-france, 75380",media,www.vivendi.com,11,33 1 71711000,11
iss as,denmark,"354,341","buddingevej 197, soeborg, 2860",business and consumer services,www.issworld.com,4,45  38170000,11
akzo nobel nv,netherlands,"35,600","christian neefestraat 2, po box 75730, amsterdam, 1077ww",chemicals,www.akzonobel.com,13,31 20 5027555,11
